,labels,sentences
4917,eosio.stackexchange.com.txt,"""JsSignatureProvider is not a constructor"" in Firebase Cloud Function"
4918,photo.stackexchange.com.txt,How can I remove color cast created by a defective scanner?
4919,mechanics.stackexchange.com.txt,Ford Focus - bad starter?
4920,spanish.stackexchange.com.txt,What's the etymology of `ir de compras`?
4921,martialarts.stackexchange.com.txt,Video evidence of Aikido applied against a resisting non-aikidoka?
4922,musicfans.stackexchange.com.txt,Anyone know where I can find a list of the top 100 or so music hits in SPANISH from each year starting at the 50s or 60?
4923,sitecore.stackexchange.com.txt,JavaScript Error when adding Submit Email field
4924,eosio.stackexchange.com.txt,"How to list all tables I have on main-net account, and how do I see the table keys?"
4925,sports.stackexchange.com.txt,Is MLB Statcast data permanently archived somewhere?
4926,unix.stackexchange.com.txt,Alternatives to FVWM window manager?
4927,movies.stackexchange.com.txt,"What was the earliest mass-release movie that used Matrix-like ""bullet time""?"
4928,martialarts.stackexchange.com.txt,Starting two or more different martial arts at the same time
4929,gaming.stackexchange.com.txt,Giving resources directly to other citizens in Die2Nite
4930,photo.stackexchange.com.txt,How to photograph sun bursts through tree canopy?
4931,webapps.stackexchange.com.txt,How can I search for multiple tags in Google Bookmarks?
4932,pm.stackexchange.com.txt,"What is the typical ratio of PM/EM hours to ""work"" hours in a project?"
4933,rpg.stackexchange.com.txt,Is there a list of non-OGL monsters?
4934,japanese.stackexchange.com.txt,"""jikuu o koete haruka tabi suru bokura"" why this phrase is written this way?"
4935,philosophy.stackexchange.com.txt,"Is ""micro"" more specific than ""small""?"
4936,softwarerecs.stackexchange.com.txt,"Hosting Options for Django, PostgreSQL and Java Cron Job support"
4937,patents.stackexchange.com.txt,"Can I patent and create an existing service with a different name, in a different state?"
4938,sharepoint.stackexchange.com.txt,Client Object Model gives 401 when impersonating logged in user - MVC App
4939,ru.stackoverflow.com.txt,Данные из файла в массив
4940,latin.stackexchange.com.txt,"Latin word for ""decided dichotomous possibility"""
4941,networkengineering.stackexchange.com.txt,How do you alias a command in JunOS?
4942,martialarts.stackexchange.com.txt,"Taekwondo technique similar to ""Kamehameha""?"
4943,gamedev.stackexchange.com.txt,Changing textures on a Model messes up antialiasing? (XNA)
4944,spanish.stackexchange.com.txt,"When to use the article ""el"" with infinitives in Spanish?"
4945,softwarerecs.stackexchange.com.txt,Android application to play videos at accelerated speed
4946,hsm.stackexchange.com.txt,"When or why & who originated this puzzle, $0.999... = 1$"
4947,quant.stackexchange.com.txt,Calculate and compare IRR among products and companies
4948,hermeneutics.stackexchange.com.txt,Hebrews 11:28 Destroyer or Destroyer of firstborns?
4949,ru.stackoverflow.com.txt,Какие проекты написать для закрепления знаний на C#?
4950,superuser.com.txt,OS X Gimp implementation that doesn't use X11
4951,sitecore.stackexchange.com.txt,Publishing Scaling multiple CM servers
4952,esperanto.stackexchange.com.txt,Is it possible to order the intensity of Esperanto adjectives?
4953,pt.stackoverflow.com.txt,"Centralizar uma Div entre duas outras, uma em cada extremo"
4954,musicfans.stackexchange.com.txt,What is the controversy between Jay Z and Nas?
4955,japanese.stackexchange.com.txt,What does 「なし」in 「問題なし」 mean?
4956,softwarerecs.stackexchange.com.txt,Open source remote access software for Windows
4957,serverfault.com.txt,"Hey Admins, What's your way to query rdp session opened on a Windows Server and Kill/logoff/Reset a rdp session?"
4958,lifehacks.stackexchange.com.txt,Remove Ink That's Scribbled on top of Printed Text?
4959,politics.stackexchange.com.txt,POTUS' power over television networks
4960,french.stackexchange.com.txt,What is the correct French noun for a school report?
4961,hermeneutics.stackexchange.com.txt,"What does the phrase ""children of wrath"" mean in Ephesians 2:3?"
4962,iota.stackexchange.com.txt,Why are the 50% I reveal when signing random?
4963,mythology.stackexchange.com.txt,What are the 365 virtues?
4964,sharepoint.stackexchange.com.txt,Intermittent problem saving to MOSS 2007 from office 07 applications
4965,ru.stackoverflow.com.txt,Поиск значения в массиве с заменой
4966,gamedev.stackexchange.com.txt,Simulate 3D with 2D sprites
4967,tex.stackexchange.com.txt,Vertically Centering Text/Numbers in Rows of Array using Math Mode
4968,monero.stackexchange.com.txt,Mining intermittently throughout the day
4969,expressionengine.stackexchange.com.txt,Download / CD as a product options in Expresso Store
4970,hsm.stackexchange.com.txt,Did Abraham De Moivre really predict his own death?
4971,german.stackexchange.com.txt,"""So"" in German - meanings and usages"
4972,networkengineering.stackexchange.com.txt,Why is the as-path so long?
4973,tor.stackexchange.com.txt,Tor failed to establish a Tor network connection with errors
4974,musicfans.stackexchange.com.txt,"Which famous musicians despise piano competitions, barring Bartók and Ives?"
4975,interpersonal.stackexchange.com.txt,"My Godmother has ""cut off ties"" with me. How can I apologize in order to fix the relationship?"
4976,mathematica.stackexchange.com.txt,How do I find line integrals?
4977,quantumcomputing.stackexchange.com.txt,Does quantum computing provide any speedup in evaluation of transcendental functions?
4978,physics.stackexchange.com.txt,How air humidity affects how much time is needed for heating the air?
4979,robotics.stackexchange.com.txt,Follow up question to Robot path planning
4980,physics.stackexchange.com.txt,Help getting the distance an object has moved
4981,security.stackexchange.com.txt,Encrypting content using same secret key as hash?
4982,space.stackexchange.com.txt,"How will they lower the landed side boosters after landing, if there is a nose cone?"
4983,raspberrypi.stackexchange.com.txt,Alternative of sudo in Raspbian
4984,networkengineering.stackexchange.com.txt,Deploying an IPSEC secure-channel - isakmp SA empty
4985,stellar.stackexchange.com.txt,Can you create an account with a non-native asset
4986,ux.stackexchange.com.txt,How do rounded corners affect usability?
4987,space.stackexchange.com.txt,Does SpaceX plan to enhance/change the genome of space colonists to speed up the adaptation process to the living conditions on Mars?
4988,mechanics.stackexchange.com.txt,Car won't start or stay running after a jump
4989,superuser.com.txt,What is the best way to protect my computer from virus and screen readers?
4990,skeptics.stackexchange.com.txt,Did the BBC fake scenes in Planet Earth 2 with composite shots and CGI?
4991,hardwarerecs.stackexchange.com.txt,"HDD 2.5"" mobile rack without chipset, just direct connection to SATA"
4992,superuser.com.txt,"""No space left on device"" after resizing partition"
4993,softwarerecs.stackexchange.com.txt,Document scanning software with OCR that takes advantage of multiple CPUs
4994,hsm.stackexchange.com.txt,Peano's Axioms: their real origin
4995,engineering.stackexchange.com.txt,Active suspension with accelerometers and displacement observer/estimator problem
4996,stellar.stackexchange.com.txt,Core breaks after upgrade to 10.0.0
4997,travel.stackexchange.com.txt,Re-entering Israel as a tourist after student visa expires?
4998,sqa.stackexchange.com.txt,How to access database from SoapUI for test-data generation?
4999,musicfans.stackexchange.com.txt,"Lyrics of ""Keep it up"" by Snap?"
5000,vi.stackexchange.com.txt,How to fake a script file name inside a monolithic vimrc?
5001,sharepoint.stackexchange.com.txt,Add Calendar list to WikiPage using Powershell
5002,tezos.stackexchange.com.txt,Is the decimals can be change when protocol updating?
5003,hardwarerecs.stackexchange.com.txt,Cheap Wi-Fi + small mono display + a couple of buttons
5004,eosio.stackexchange.com.txt,What are the units of the total_votes in the producer_info structure?
5005,pets.stackexchange.com.txt,Why has my 8 Month old Puppy started to whine?
5006,musicfans.stackexchange.com.txt,What is the song of this guitar intro?
5007,judaism.stackexchange.com.txt,What is the meaning of tehom?
5008,health.stackexchange.com.txt,Is there ever a time when an appendicitis is not an emergency? Could it explain chronic pain in lower abdomen/pelvis?
5009,english.stackexchange.com.txt,Is the word “formulæ” valid English?
5010,mechanics.stackexchange.com.txt,Engine misfire during load at 2500+ rpms on 3rd and 4th gears
5011,sound.stackexchange.com.txt,Is there software to capture and view raw MIDI data coming from a controller?
5012,pt.stackoverflow.com.txt,Exibir ListView com redes disponíveis
5013,japanese.stackexchange.com.txt,"Asking a question with ""da"" and ""datta"""
5014,softwareengineering.stackexchange.com.txt,Handling SMS/email convergence: how does a good business app do it?
5015,genealogy.stackexchange.com.txt,How do descendants of twins affect DNA matching?
5016,latin.stackexchange.com.txt,What semantic notions underlie ex/in-tēnsiō with the logical meanings of ex/in-tension?
5017,movies.stackexchange.com.txt,"Why were the deposition tapes dated November 10, 2017?"
5018,iota.stackexchange.com.txt,Will the total supply of IOTA tokens ever increase?
5019,english.stackexchange.com.txt,"What usage and meaning of ""else"" is this"
5020,vegetarianism.stackexchange.com.txt,Why are so many YouTubers giving up veganism now?
5021,parenting.stackexchange.com.txt,Does separating necessarily cause damage?
5022,tex.stackexchange.com.txt,Rules of thumb for size of binding correction (BCOR)
5023,salesforce.stackexchange.com.txt,what are salesforce knowledge article use cases?
5024,latin.stackexchange.com.txt,How do you translate these verbal adjectives? (Greek)
5025,vegetarianism.stackexchange.com.txt,What are the top causes of death for vegetarians?
5026,expressionengine.stackexchange.com.txt,Import only a specific node type
5027,raspberrypi.stackexchange.com.txt,Missing pand command: which package does it belong to?
5028,hinduism.stackexchange.com.txt,"What is the significance of 3, 16, or 41 days after the death?"
5029,ja.stackoverflow.com.txt,Ruby on Rails & Heroku で作った静的ページが facebook canvas で表示できない
5030,health.stackexchange.com.txt,How would oral medication be given to patient in ICU that can't swallow?
5031,martialarts.stackexchange.com.txt,Which martial arts exercise helps to reduce weight?
5032,softwareengineering.stackexchange.com.txt,Why has C prevailed over Pascal?
5033,rpg.stackexchange.com.txt,What is the single most influential book every GM should read?
5034,sustainability.stackexchange.com.txt,Which has a smaller footprint -- canned or frozen vegetables?
5035,islam.stackexchange.com.txt,"What does ""if Allah had a son"" mean? Does it indicate that Allah can have a son?"
5036,ru.stackoverflow.com.txt,Лучший способ парсить поток XML?
5037,movies.stackexchange.com.txt,Why did Cersei and Jaime not go after the person that knew their secret?
5038,hermeneutics.stackexchange.com.txt,Did household conversions recorded in the Bible include teenagers and children?
5039,hsm.stackexchange.com.txt,What are other ancient encyclopaedic texts like Pliny's “Naturalis Historia” that were available in medieval times?
5040,photo.stackexchange.com.txt,Suitability of zoom lens to 5D full frame sensor camera
5041,writers.stackexchange.com.txt,What should a new edition of a novel consist of?
5042,softwarerecs.stackexchange.com.txt,Simple Monitor system (ping only)
5043,esperanto.stackexchange.com.txt,"How do we tackle creating an Esperantujo ""census"", or begin gaining a picture of our actual demographics?"
5044,sports.stackexchange.com.txt,What are the roles of the various officials in badminton?
5045,magento.stackexchange.com.txt,"Receiving error message ""Enterprise_Pci requires module Mage_Api"""
5046,eosio.stackexchange.com.txt,What's the size of a word in the EOS virtual machine?
5047,latin.stackexchange.com.txt,Should I study Latin in English or in Spanish?
5048,fitness.stackexchange.com.txt,What exercises help toning and firming up after losing weight
5049,scifi.stackexchange.com.txt,Who ran Ten-Forward before Guinan?
5050,stellar.stackexchange.com.txt,How to use Stellar to Build International Remittance app
5051,magento.stackexchange.com.txt,translation of Mr. and Mrs. prefix options
5052,sharepoint.stackexchange.com.txt,Excel 2003 compatibility with SharePoint standard edition 2007
5053,stackoverflow.com.txt,How Do You Insert XML Into an existing XML node
5054,matheducators.stackexchange.com.txt,How do you explain why perpendicular lines have negative reciprocated slopes?
5055,gis.stackexchange.com.txt,Breaking single polygon into multiple polygons?
5056,outdoors.stackexchange.com.txt,What advantage would noodling have over fishing with rod and reel?
5057,opensource.stackexchange.com.txt,Can any Firefox add-on be free software now that add-on signing is required?
5058,eosio.stackexchange.com.txt,Get all associated EOS accounts linked to a public key using javascript using a public endpoint?
5059,writers.stackexchange.com.txt,I need help with this story!
5060,philosophy.stackexchange.com.txt,Can any piece of knowledge be produced without depending on another piece of knowledge?
5061,joomla.stackexchange.com.txt,How to delete BT Content Slider's article first-letter blank space?
5062,ux.stackexchange.com.txt,Why print the text of a color name in that color?
5063,graphicdesign.stackexchange.com.txt,How to type two characters on top of each other (superscript) in InDesign
5064,fitness.stackexchange.com.txt,Does not starting with the empty bar in StrongLifts 5x5 really hinder your ability to add weight every workout?
5065,softwarerecs.stackexchange.com.txt,Sort folders on FAT32 drive from a Windows command line
5066,hardwarerecs.stackexchange.com.txt,"NFC wand (or shield, or other) for Raspberry Pi"
5067,ham.stackexchange.com.txt,How can I determine if out of band interference is affecting my AIS reception?
5068,eosio.stackexchange.com.txt,Issue while compiling smart contract - eosio.cdt
5069,tezos.stackexchange.com.txt,How to call a smart contract method with params with eztz?
5070,languagelearning.stackexchange.com.txt,Is it more efficient to make flashcards for L3 in L2 and L1?
5071,sustainability.stackexchange.com.txt,Where can I find a detailed technical description of a system to use Biogas as a Vehicle fuel?
5072,pm.stackexchange.com.txt,linked tools together without micro managing?
5073,photo.stackexchange.com.txt,Any reason not to use a 72mm CPOL filter with a 62mm step down ring?
5074,scicomp.stackexchange.com.txt,Numerical integration of a quadratic form exponential in two variables over a rectangle
5075,philosophy.stackexchange.com.txt,"My Car, She Was Driving, Who Pays the Lapsed Registration Ticket?"
5076,pets.stackexchange.com.txt,Caring for a dog and its 11 puppies
5077,salesforce.stackexchange.com.txt,"Long running operation did not complete, continued in background"
5078,networkengineering.stackexchange.com.txt,Exact trunk operations over an incoming tagged frame
5079,moderators.stackexchange.com.txt,How to celebrate an online community's anniversary (games etc)
5080,rpg.stackexchange.com.txt,How do I help myself recover from death?
5081,es.stackoverflow.com.txt,¿como uso un string en un struct para decidir que dato mostrar?
5082,expatriates.stackexchange.com.txt,How to complete I-9 form?
5083,korean.stackexchange.com.txt,"What's the word for ""obsolete""?"
5084,serverfault.com.txt,"How to Cent OS + SQUID + SARG: logging and reporting chat sessions, blocking sites"
5085,security.stackexchange.com.txt,Is there any way to know the contact email on a contact form?
5086,pt.stackoverflow.com.txt,Quebra linha em célula de tabela no formato CSV para ser lido pelo Excel
5087,movies.stackexchange.com.txt,What is the meaning of the final inner monologue at the end of Memento?
5088,spanish.stackexchange.com.txt,"Is ""funciones de retorno"" best translated as ""return functions"" or ""callback functions""?"
5089,german.stackexchange.com.txt,"Woher kommt das Wort ""Purzelbaum""?"
5090,stellar.stackexchange.com.txt,Seeing and using multiple order books on an asset?
5091,puzzling.stackexchange.com.txt,We are a panel of five people
5092,expatriates.stackexchange.com.txt,"I am a non-EU citizen, one of 3 directors of a company in the UK. How can I work in the UK?"
5093,portuguese.stackexchange.com.txt,"What is the meaning and appropriate usage of ""fazer com que""?"
5094,politics.stackexchange.com.txt,Why did the UK remove the 'European Union' from its passport?
5095,mechanics.stackexchange.com.txt,Why do my wipers only operate at high speed?
5096,superuser.com.txt,Is there a keystroke that can lock the Mac OS X screensaver?
5097,linguistics.stackexchange.com.txt,Why are some linguists and other people very much against conlangs?
5098,sharepoint.stackexchange.com.txt,Calculated column based on values from three other item columns
5099,russian.stackexchange.com.txt,"What's the difference between ""дети бегают по магазину"" and ""дети бегают в магазине""?"
5100,webapps.stackexchange.com.txt,Editing gmail subject line when replying or forwarding
5101,stackapps.com.txt,Possible Bug With positive_rep Field?
5102,joomla.stackexchange.com.txt,When to move to a new major release?
5103,reverseengineering.stackexchange.com.txt,Can't extract machine code from Cortex-M3 firmware
5104,gamedev.stackexchange.com.txt,Defining and selecting an area from an image
5105,stackoverflow.com.txt,Passing $_POST values with cURL
5106,sqa.stackexchange.com.txt,White Label Website Automated Testing
5107,security.stackexchange.com.txt,Heartbleed - impact on iOS apps?
5108,pt.stackoverflow.com.txt,"Apos mudar o nome de um campo em uma tabela, como fazer para atualizar todo o projeto Rails?"
5109,workplace.stackexchange.com.txt,How should I approach my manager on matters of personal hygiene?
5110,martialarts.stackexchange.com.txt,Where can I find a good source for invisible strike
5111,fitness.stackexchange.com.txt,preventing muscle and energy level loss after an upset stomach
5112,homebrew.stackexchange.com.txt,How do you tell if your fermentation is stuck?
5113,philosophy.stackexchange.com.txt,Is war started by one person or a country?
5114,sitecore.stackexchange.com.txt,Omit bucket folders from page urls - linkprovider not working in SXA
5115,sharepoint.stackexchange.com.txt,Unabe to create Search Service Application
5116,or.stackexchange.com.txt,How to innovate in OR
5117,languagelearning.stackexchange.com.txt,Are there any studies showing that absolute pitch affects second language acquisition?
5118,quant.stackexchange.com.txt,Why is there a need for Libor in the UK
5119,esperanto.stackexchange.com.txt,"When should I use ""tiam, kiam"" instead of just ""kiam""?"
5120,iota.stackexchange.com.txt,Why does the least significant trit come first?
5121,iot.stackexchange.com.txt,By what mechanism are IoT widgets vulnerable to hacking?
5122,law.stackexchange.com.txt,People have said that the FBI couldn’t raid Epstein’s Island before his “death”
5123,interpersonal.stackexchange.com.txt,How do I to tell someone to stop criticizing what we do?
5124,islam.stackexchange.com.txt,Cleaning/Washing hands in plate after meals
5125,salesforce.stackexchange.com.txt,Error in deploying letterheads using ant
5126,pm.stackexchange.com.txt,Feature Teams - Project with multiple teams
5127,iota.stackexchange.com.txt,"If part of a data stream does not confirm, is that data corrupted?"
5128,lifehacks.stackexchange.com.txt,How do I keep dust away when applying a laptop screen protector?
5129,gis.stackexchange.com.txt,How to place multiple symbols on one polygon centroid?
5130,raspberrypi.stackexchange.com.txt,Can I use the Playstation Eye webcam's microphone with Raspberry
5131,ham.stackexchange.com.txt,Which country’s hams have the longest call signs?
5132,graphicdesign.stackexchange.com.txt,How can I create a tight spiral shape? (Archimedean spiral)
5133,gamedev.stackexchange.com.txt,JiglibX addition to existing project questions
5134,interpersonal.stackexchange.com.txt,How do you tactfully write that someone's reply doesn't truly answer your question?
5135,puzzling.stackexchange.com.txt,What am I? and Who is my maker?
5136,russian.stackexchange.com.txt,"Is ""мочиться"" a vulgar or indecent word to any extent?"
5137,german.stackexchange.com.txt,"Which of the following phrases (""Ein Saal voll von Menschen"" or ""Ein Saal voll Menschen"") is grammatically correct?"
5138,photo.stackexchange.com.txt,Is it possible to export labels/ratings from ViewNX2?
5139,windowsphone.stackexchange.com.txt,Nokia 640 some Bluetooth files don't show up
5140,english.stackexchange.com.txt,“out loud”: is it hyphenated or not?
5141,graphicdesign.stackexchange.com.txt,How can I have prints with white ink?
5142,stellar.stackexchange.com.txt,How can I close a Stellar Account?
5143,pm.stackexchange.com.txt,How to justify to ask for the technologies stack of the customer application in precise manner?
5144,eosio.stackexchange.com.txt,What is the reason for most of the block producers to be located in the Asia area?
5145,mythology.stackexchange.com.txt,Destruction of the universe by fire in the Ancient Greek canon?
5146,ru.stackoverflow.com.txt,Создание исполняемого файла в hex-редакторе на Linux
5147,mathematica.stackexchange.com.txt,"Automating the ""Get Indices"" right click function"
5148,hsm.stackexchange.com.txt,"When William Herschel discovered Uranus, who else at the time had a comparable telescope?"
5149,mathematica.stackexchange.com.txt,Speeding up export of a matrix to a dat file
5150,travel.stackexchange.com.txt,"Podgorica, Montenegro to Tirana, Albania by public transport"
5151,puzzling.stackexchange.com.txt,Don't end up falling for the nonsense
5152,softwarerecs.stackexchange.com.txt,"""Bullet proof parental control software?"""
5153,workplace.stackexchange.com.txt,How to address a large direct deposit shortfall
5154,math.stackexchange.com.txt,What's special about the greatest common divisor of a + b and a - b?
5155,softwarerecs.stackexchange.com.txt,App for Android that reads Open Street Map data but can be used as a GPS or for Directions
5156,hinduism.stackexchange.com.txt,In which year did Varahamihira write his Brihat Samhita?
5157,quant.stackexchange.com.txt,"pair trading cointegration - calculating shares quantities traded, portfolio value and returns"
5158,physics.stackexchange.com.txt,Why are some of the biggest stars known blue?
5159,pets.stackexchange.com.txt,"Are there any vaccines that are needed for cows in Gujarat, India?"
5160,english.stackexchange.com.txt,What is the origin of the slang term “book” meaning “leave” or “hurry”?
5161,security.stackexchange.com.txt,Snort (IDS) Don't show Port Scans
5162,pm.stackexchange.com.txt,How to name written data that it will likely be used later in the project?
5163,mechanics.stackexchange.com.txt,Is it safe if I forgot to put the handbrake on when I turn off the car?
5164,ethereum.stackexchange.com.txt,Can an account give conditional instruction to EVM
5165,security.stackexchange.com.txt,Best way to store passwords for a LAN tool?
5166,travel.stackexchange.com.txt,What are the consequences of a US citizen overstaying a Schengen visa?
5167,pm.stackexchange.com.txt,Best way to handle different stakeholders?
5168,gaming.stackexchange.com.txt,How to militarily delay a science victory?
5169,stats.stackexchange.com.txt,Testing significance of overlap in R
5170,law.stackexchange.com.txt,Reimbursement for business use of personal phone
5171,softwarerecs.stackexchange.com.txt,Documenting solutions implemented in a software project
5172,serverfault.com.txt,How do I use PuTTY to connect to a local server in a DHCP network without specifying the IP?
5173,engineering.stackexchange.com.txt,Modeling Friction-reduced Pressure Drop in Natural Gas Flowing along a Horizontal Cylindrical Trunkline (Pipe)
5174,reverseengineering.stackexchange.com.txt,What additional data does a compiler populate the buffer space with?
5175,webapps.stackexchange.com.txt,EXCLUDE email addresses from autoresponder?
5176,unix.stackexchange.com.txt,Vim syntax highlight certain lines
5177,security.stackexchange.com.txt,How long does it take to break 128-bit key
5178,hardwarerecs.stackexchange.com.txt,Can I connect two computers using a Thunderbolt 3 cable using ethernet?
5179,expressionengine.stackexchange.com.txt,How to add custom field in ExpressionEngine publish entry
5180,expressionengine.stackexchange.com.txt,Expresso Store Custom Payment Gateway
5181,rpg.stackexchange.com.txt,"For the purposes of the Monk's AC bonus class feature, does the Gunman's Duster count as armor?"
5182,quant.stackexchange.com.txt,von Neumann boundary in the transformed PDE
5183,gaming.stackexchange.com.txt,What is the minimum required speed for Xbox live?
5184,math.stackexchange.com.txt,when inf and sup of a subset achievable in itself?
5185,philosophy.stackexchange.com.txt,Is there a way to tell which philosophers are correct in their musings?
5186,ux.stackexchange.com.txt,Announcement text length should be restricted or not?
5187,superuser.com.txt,Convert office document to PDF with horizontal page in the middle
5188,salesforce.stackexchange.com.txt,Field isn't spanning the full table row
5189,workplace.stackexchange.com.txt,Switching career from firmware engineer to hardware engineer. Is it possible?
5190,math.stackexchange.com.txt,Branch cut of the logarithm
