,labels,sentences
2465,woodworking.stackexchange.com.txt,"At what stage of basic furniture making should I ""finish"" the wood?"
2466,french.stackexchange.com.txt,"Etymology and usage of idiom ""d'accord, Hector!"""
2467,skeptics.stackexchange.com.txt,Are ants afraid of chalk and won't cross a chalk line?
2468,stats.stackexchange.com.txt,Why are cumulative residuals from regression on stock and index returns mean reverting
2469,expressionengine.stackexchange.com.txt,Issues with counter when using exp:zoo_triggers:catergories
2470,quantumcomputing.stackexchange.com.txt,What is the notational convention for the single-qubit states $\lvert0\rangle\pm i\lvert1\rangle$?
2471,pt.stackoverflow.com.txt,Atualizar versão do Entity framework
2472,homebrew.stackexchange.com.txt,"Irish Ale Yeast - Strain Selection, Fermentation Temps, and Re-using Yeast"
2473,patents.stackexchange.com.txt,Prior art on Wireless Deadbolt Actuator (Keyless entry)
2474,scifi.stackexchange.com.txt,Why were there 13 Doctors prior to #12?
2475,hermeneutics.stackexchange.com.txt,Why Luke's gospel was originally anonymous?
2476,wordpress.stackexchange.com.txt,Post Format single-loop.php using get_template_part
2477,eosio.stackexchange.com.txt,"running hello.cpp tutorial, stuck at compiling WASM, abigen error, file read error"
2478,spanish.stackexchange.com.txt,How to distinguish between the 1st & 3rd person singular conjugation in the subjunctive?
2479,korean.stackexchange.com.txt,How to understand the -하다고 suffix?
2480,ukrainian.stackexchange.com.txt,"Як перекласти з російської ""новодел""?"
2481,writers.stackexchange.com.txt,Are there valid reasons to write Java Annotation (or .NET XML Documentation) for private methods?
2482,scifi.stackexchange.com.txt,Are all the ghosts at Hogwarts former students/teachers?
2483,gaming.stackexchange.com.txt,"Are there any games/tactics where infestor controlled units are used to build ""foreign"" units?"
2484,ukrainian.stackexchange.com.txt,"Як правильно перекласти ""method dispatch""?"
2485,ham.stackexchange.com.txt,"With solid-state equipment, when would one use a dummy load?"
2486,serverfault.com.txt,Can't see progress of rolling back SPID with KILL WITH STATUSONLY
2487,stats.stackexchange.com.txt,One component in PCA is always the mean vector in two-dimensions but not three
2488,sharepoint.stackexchange.com.txt,How can I update the record in sharepoint 2010 using linq?
2489,esperanto.stackexchange.com.txt,"How can I say ""belong (somewhere)""?"
2490,workplace.stackexchange.com.txt,State in the contract that software developer delivers only binary code not source code?
2491,iot.stackexchange.com.txt,WiFi communication between PC and embedded system on LAN
2492,graphicdesign.stackexchange.com.txt,What's the name of this distorted / dirty brush?
2493,interpersonal.stackexchange.com.txt,How do I politely let a professor know she has offended me?
2494,opendata.stackexchange.com.txt,Where can I get shapefiles for changing German territory during the Second World War?
2495,stellar.stackexchange.com.txt,Getting all offers for a particular Asset (pair)
2496,unix.stackexchange.com.txt,Is it possible to use a router with dd-wrt/openWrt/etc as a radar detector?
2497,health.stackexchange.com.txt,Question about pregnancy and epidural anesthesia: How can a woman give birth under anesthesia?
2498,gaming.stackexchange.com.txt,Escaping from League of Legends Elo Hell
2499,matheducators.stackexchange.com.txt,Does learning classical approach to differential geometry before modern approach help or hinder?
2500,homebrew.stackexchange.com.txt,What yeast should I use to make a semi-sweet Ginger Beer with about 5% ABV
2501,graphicdesign.stackexchange.com.txt,How to know how much to charge for an animation?
2502,superuser.com.txt,How to take screenshots in Mac OS X?
2503,money.stackexchange.com.txt,What is a financial security?
2504,softwarerecs.stackexchange.com.txt,"Location-based reminder (Android, open source)"
2505,stackoverflow.com.txt,"What is the best way to go in the long term: C, Objective C, or C++?"
2506,scicomp.stackexchange.com.txt,Textbook/Manual on Implicit FEM Methods
2507,mathematica.stackexchange.com.txt,Am I entering this 2-variable recurrence correctly?
2508,pt.stackoverflow.com.txt,Como concatenar um input name com uma variável em jQuery?
2509,italian.stackexchange.com.txt,"In che cosa consiste un ""tetto a colombaia""?"
2510,expressionengine.stackexchange.com.txt,Handle Dynamic IP Addresses on Login
2511,sports.stackexchange.com.txt,"Does a shot hitting the woodwork count as a ""shot on target"" in football?"
2512,italian.stackexchange.com.txt,"C'è qualche differenza tra ""attirare"" e ""attrarre""?"
2513,pets.stackexchange.com.txt,Chorkie - Posy Op - Red Blister
2514,stellar.stackexchange.com.txt,Using S3 as Archive for Standalone Node
2515,stats.stackexchange.com.txt,Trying to run statistical tests in R but struggling as I am new to the language
2516,ukrainian.stackexchange.com.txt,"What is the difference between питання, запит, and запитання?"
2517,raspberrypi.stackexchange.com.txt,X11 using xming and PuTTy: “cannot open display” problem
2518,pt.stackoverflow.com.txt,Erro em instalação de Pacote?
2519,graphicdesign.stackexchange.com.txt,"Billboard Designing: Why design at higher resolution instead of the actual, lower print resolution?"
2520,sqa.stackexchange.com.txt,Report Generation using Karate framework through Jenkins
2521,es.stackoverflow.com.txt,¿JPA/MySQL definir Zona horaria para tipo TIME?
2522,puzzling.stackexchange.com.txt,A strange sight in London
2523,fitness.stackexchange.com.txt,Is it possible to maintain or improve as a runner doing mostly races?
2524,pm.stackexchange.com.txt,Are Scrum build and test phases separate?
2525,sustainability.stackexchange.com.txt,Why are electrical cars encouraged but is electrical heating discouraged?
2526,ethereum.stackexchange.com.txt,Account Balance 0 after 1 full day of GPU mining - GTX 770 - go-ethereum and ethminer
2527,esperanto.stackexchange.com.txt,Ĉu ekzistas lernolibroj por lerni la Anglan pere de Esperanto?
2528,esperanto.stackexchange.com.txt,Does Esperanto make people friendlier?
2529,expatriates.stackexchange.com.txt,Can I invite my parents from inside another EU country?
2530,serverfault.com.txt,Url redirect to another page on the same site
2531,rus.stackexchange.com.txt,Верна ли пунктуация вкупе с кавычками?
2532,stellar.stackexchange.com.txt,Is there a way to unset home domain and inflation destination options?
2533,sports.stackexchange.com.txt,What Effect Could Splits or Cracks in a Cricket Bat Have?
2534,puzzling.stackexchange.com.txt,What do you mean by this rebus?
2535,eosio.stackexchange.com.txt,Creating a keypair through the RPC API
2536,webmasters.stackexchange.com.txt,Migrate facebook app from WAMP Server localhost to facebook
2537,engineering.stackexchange.com.txt,How should I set the turbulent prandtl number in a turbulent compressible flow simulation?
2538,raspberrypi.stackexchange.com.txt,USB Issues with recent kernel build
2539,parenting.stackexchange.com.txt,How do we stop our daughter rolling over and waking herself up?
2540,serverfault.com.txt,Home Backup Strategy for Large Amounts of Data
2541,eosio.stackexchange.com.txt,How to access the EOS Distribution app?
2542,literature.stackexchange.com.txt,"Is there a direct parallel to actual social prejudices for each color in ""The War Between the Classes""?"
2543,vi.stackexchange.com.txt,Why is <C-S> not remappable?
2544,pm.stackexchange.com.txt,Project complete but does not really satisfy the end users. Business owners unhappy
2545,serverfault.com.txt,Should you discharge a Li-ion battery all the way?
2546,quant.stackexchange.com.txt,Factor Models: uncorrelated errors don't impact covariances of assets
2547,gaming.stackexchange.com.txt,How can I determine if a used game is pirated?
2548,photo.stackexchange.com.txt,Which Camera is better to take photo of wild birds?
2549,rus.stackexchange.com.txt,Влияет ли местоположение вводного слова на смысл предложения?
2550,ukrainian.stackexchange.com.txt,Розквітнуть чи розквітнуться? Чи є різниця?
2551,japanese.stackexchange.com.txt,expressing casual potential for adjectives
2552,salesforce.stackexchange.com.txt,Trigger to do a count of assets based on brand and show on accounts
2553,freelancing.stackexchange.com.txt,Best website to get freelancer work
2554,woodworking.stackexchange.com.txt,Proper bit selection for plunge router?
2555,parenting.stackexchange.com.txt,"Should I let food be a way out of a ""time out""?"
2556,fitness.stackexchange.com.txt,What the is correct form for a Hindu Pushup
2557,woodworking.stackexchange.com.txt,Using newly cut wood with dry wood
2558,gaming.stackexchange.com.txt,How do I make an effective Minecraft SMP trap?
2559,lifehacks.stackexchange.com.txt,How to repair and clean traffic cones?
2560,superuser.com.txt,"Windows vista, IIS7 and error messages/pages"
2561,wordpress.stackexchange.com.txt,Is there a way to measure server resource (CPU) usage by WP plugins?
2562,ham.stackexchange.com.txt,Is there any PC remote control software for the Baofeng UV-5RE Plus?
2563,parenting.stackexchange.com.txt,How to test whether my toddler is allergic to detergent?
2564,stackoverflow.com.txt,Newbie wants to create a PDF reader for ipod touch - what's the best approach?
2565,spanish.stackexchange.com.txt,"¿De dónde viene la expresión ""doler prendas""?"
2566,hsm.stackexchange.com.txt,How can I be sure that a certain term ocurred first in a certain textbook?
2567,eosio.stackexchange.com.txt,EOS error while pushing transaction
2568,korean.stackexchange.com.txt,"How to say sentences like : the less this, the less that/the less this, the more that/"
2569,graphicdesign.stackexchange.com.txt,Will changing image resolution from 300 to 72 without resampling reduce the quality?
2570,windowsphone.stackexchange.com.txt,NR Deluxe support or alternitives?
2571,parenting.stackexchange.com.txt,What can I do to encourage my 12 year old son to enjoy productive activities?
2572,monero.stackexchange.com.txt,Can Monero ever have a 10 sec. block-time?
2573,stats.stackexchange.com.txt,Significance testing or cross validation?
2574,space.stackexchange.com.txt,What happens when LOX and H2 are injected into the combustion chamber of a rocket?
2575,hsm.stackexchange.com.txt,Does anyone know the physics student who passed a quantum mechanics oral exam without taking quantum mechanics?
2576,russian.stackexchange.com.txt,What is the order of adjectival premodifiers?
2577,monero.stackexchange.com.txt,Transaction from GUI wallet to bittrex account never arrived. PLEASE HELP
2578,writers.stackexchange.com.txt,Is it a bad writing practice to open a story with a time frame when the time frame is irrelevant?
2579,gis.stackexchange.com.txt,Debugging RuntimeError: Object: Error in executing tool from arcpy.RasterDomain_3d()?
2580,math.stackexchange.com.txt,Does there exists a absolute measure for growth-rate of a function?
2581,judaism.stackexchange.com.txt,Shemona Ve'esrim Ushlosh Meyot - mi yodeya?
2582,graphicdesign.stackexchange.com.txt,A font that covers the UTF-8 encoding entirely?
2583,hardwarerecs.stackexchange.com.txt,Carrying case for a device and some accessories
2584,expressionengine.stackexchange.com.txt,Problem setting Fieldframe path on EE 1.x site
2585,german.stackexchange.com.txt,"How to say ""The path he is going along"""
2586,ru.stackoverflow.com.txt,Как передать $_POST в 403.php
2587,sharepoint.stackexchange.com.txt,My Profile note board access in code
2588,math.stackexchange.com.txt,Creating data set to match a particular distribution
2589,expatriates.stackexchange.com.txt,Indian citizen planning to marry a Polish citizen
2590,tex.stackexchange.com.txt,Bibliography style which extracts only the initials of the first names
2591,latin.stackexchange.com.txt,Are there dictionaries that translate profanities profanely?
2592,graphicdesign.stackexchange.com.txt,Dark Theme vs Light Theme in Web Applications
2593,softwareengineering.stackexchange.com.txt,How can a team apply the Scrum methodology without a clear customer?
2594,magento.stackexchange.com.txt,Paypal Payment Method Missing from Backend Order
2595,hsm.stackexchange.com.txt,Was there any name for electrical sparks before 'electric' and its related terms were invented?
2596,tridion.stackexchange.com.txt,"error ""File/folder does not exists!"" when attempting to load metadata.xml with run-etl-job command"
2597,iota.stackexchange.com.txt,How can I track the distribution of iota?
2598,ru.stackoverflow.com.txt,Как оптимизировать поиск в Django
2599,matheducators.stackexchange.com.txt,"Pedagogy, mathematics and Dieudonné's Foundations of Modern Analysis"
2600,scicomp.stackexchange.com.txt,Numerical evaluation of gaussian-like integral expressible as a recurrence relation
2601,webapps.stackexchange.com.txt,Is it possible to link a cell in Google Spreadsheets to a Google text document? (not spreadsheets)
2602,networkengineering.stackexchange.com.txt,Is there anyway to set Quota for users in Fortigate?
2603,opendata.stackexchange.com.txt,Database of shrines in Japan
2604,sitecore.stackexchange.com.txt,How to get hostname on publish end event
2605,health.stackexchange.com.txt,"How can I obtain ""activated oxygen bleach""? I hear that it can help people to disinfect their laundry.​"
2606,money.stackexchange.com.txt,"What does the ""upgrade"" from a credit limit to a ""credit access line"" really mean?"
2607,fitness.stackexchange.com.txt,Why do so many fitness websites still reference somatotypes?
2608,pm.stackexchange.com.txt,what is the reason of calculating duration in Microsoft Project in decimal form?
2609,quantumcomputing.stackexchange.com.txt,Hamiltonian simulation in quantum computation
2610,webmasters.stackexchange.com.txt,Will crawlers find content that appears after document.ready using javascript?
2611,graphicdesign.stackexchange.com.txt,Cut a Grouped Circle in Half without Extra Borders Being Created
2612,matheducators.stackexchange.com.txt,What's the most effective way to introduce/motivate the anti-derivative of $\sec x$?
2613,hardwarerecs.stackexchange.com.txt,Which wifi router can download and seed torrent?
2614,musicfans.stackexchange.com.txt,Can someone please help me find the name of this song?
2615,webmasters.stackexchange.com.txt,How to Add Two Domains ON 1 IP using webmin
2616,hsm.stackexchange.com.txt,What results did C. F. Gauss add to Euler’s dioptrics?
2617,expressionengine.stackexchange.com.txt,"Listing entries, ordering by Category"
2618,sustainability.stackexchange.com.txt,Is cheese as bad as beef for the environment?
2619,sustainability.stackexchange.com.txt,Do #4 (♶ LDPE) plastic bags need to be recycled at grocery stores like #2 (♴ HDPE) plastic bags?
2620,photo.stackexchange.com.txt,Are these black lines on Canon S100 an LCD fault or something else?
2621,softwarerecs.stackexchange.com.txt,Web performance analyzer that works offline / locally (alternate to YSlow)
2622,sitecore.stackexchange.com.txt,how to change the default behaviour of displaying the WFFM required field error text
2623,sports.stackexchange.com.txt,Why are points awarded 2 and 3 in basketball?
2624,raspberrypi.stackexchange.com.txt,Convert the frame data from recording into a numpy array
2625,mathematica.stackexchange.com.txt,Reconstructing an image from overlapping patches
2626,fitness.stackexchange.com.txt,Assisted PullUp Machine or Inverted Row?
2627,german.stackexchange.com.txt,"How do I say ""I am deep in thought"" in German?"
2628,security.stackexchange.com.txt,Data remanence on mobile devices
2629,eosio.stackexchange.com.txt,How will EOS integrate with Steem Blog system?
2630,german.stackexchange.com.txt,“to render a template” in German
2631,gamedev.stackexchange.com.txt,Which things to do in AutoCAD and which in 3ds Max?
2632,graphicdesign.stackexchange.com.txt,Help! The Minus Front in illustrator is not working properly!
2633,spanish.stackexchange.com.txt,Título laboral con mayúsculas iniciales
2634,music.stackexchange.com.txt,Getting back to music. How to play live?
2635,judaism.stackexchange.com.txt,Why is a prayer leader still removed for omitting V'lamalshinim?
2636,math.stackexchange.com.txt,Software for drawing geometry diagrams
2637,outdoors.stackexchange.com.txt,Where are good places to look for water sources when I have run out on a multi-day hike?
2638,magento.stackexchange.com.txt,How to check if billing and shipping address are equal?
2639,gamedev.stackexchange.com.txt,How do I make a vehicle move to a point and stop without overshooting or oscillating?
2640,stellar.stackexchange.com.txt,What's the maximum number of signers for a given account?
2641,politics.stackexchange.com.txt,Is the US President empowered to unilaterally revoke security clearance of sitting members of congress?
2642,homebrew.stackexchange.com.txt,Determining the amount of herbs to use
2643,math.stackexchange.com.txt,Dimension of the manifold O(n)
2644,matheducators.stackexchange.com.txt,Should I be teaching point-slope formula to high school algebra students?
2645,expressionengine.stackexchange.com.txt,Cartthrob order subtotal:plus_tax includes tax on products that aren't taxable
2646,softwareengineering.stackexchange.com.txt,What is the most inspiring speech from a developer you ever watched?
2647,math.stackexchange.com.txt,Global Sections of Sheaf and Dual
2648,lifehacks.stackexchange.com.txt,How to avoid losing keys/phone/wallet?
2649,es.stackoverflow.com.txt,Formato de dato double enviado a mysql
2650,tezos.stackexchange.com.txt,How can I deploy a Michelson smart contract?
2651,magento.stackexchange.com.txt,How to display unit after price on the checkout page
2652,rpg.stackexchange.com.txt,Weapon that does 5 damage vs. one that does 1d10 damage: What characteristic of the weapons causes this difference?
2653,gamedev.stackexchange.com.txt,Creating a newspaper that effects the game's economy?
2654,pm.stackexchange.com.txt,The SWOT analysis is applied to the company or to every decision alternative?
2655,puzzling.stackexchange.com.txt,Are we bored of add-a-grams yet? Because I've got another short one
2656,pm.stackexchange.com.txt,How to handle big stories / epics in Scrum?
2657,outdoors.stackexchange.com.txt,How is ATA measured on a compound bow?
2658,magento.stackexchange.com.txt,Stucked at billing Information section on checkout page
2659,lifehacks.stackexchange.com.txt,Pest Control - Natural Method of Ant Control - Howto
2660,music.stackexchange.com.txt,Which way should I point subwoofers in a small-medium sized venue?
2661,mythology.stackexchange.com.txt,"If Athena was born from Zeus' brain, does this mean Athena is a manifestation of Zeus' intelligence?"
2662,photo.stackexchange.com.txt,Tips & advice for photographing store/shop interiors
2663,softwarerecs.stackexchange.com.txt,Any command line tool for YQL?
2664,pm.stackexchange.com.txt,How far should you vertically slice?
2665,raspberrypi.stackexchange.com.txt,How can I get regular firefox on raspbian?
2666,lifehacks.stackexchange.com.txt,Air freshener inside phone screen
2667,gaming.stackexchange.com.txt,"Is there a point to hogtying people, instead of shooting them?"
2668,travel.stackexchange.com.txt,Which has better in-flight entertainment for a 7-year old and a 4-year old? KLM or Emirates?
2669,mythology.stackexchange.com.txt,Where did this story about stars being part of a board game come from?
2670,vegetarianism.stackexchange.com.txt,Is eating gelatin consistent with veganism on consequentialist grounds?
2671,pm.stackexchange.com.txt,What tools do you use for creating an offer and project management?
2672,matheducators.stackexchange.com.txt,Why do we prove things we already know?
2673,unix.stackexchange.com.txt,How to mount external hard disk every time the server is restarted?
2674,tor.stackexchange.com.txt,Tor Browser Bundle for Windows without installer?
2675,literature.stackexchange.com.txt,"Understanding the ending of ""The Name, the Nose"""
2676,iota.stackexchange.com.txt,How to properly move funds from Wallet A to Wallet B without being exposed to security risks?
2677,lifehacks.stackexchange.com.txt,How to eat barbecue ribs without getting covered in barbecue sauce?
2678,health.stackexchange.com.txt,Is all protein the same?
2679,woodworking.stackexchange.com.txt,"Is there still a place for ""hand drills"" in a modern woodshop?"
2680,physics.stackexchange.com.txt,Origins of the principle of least time in classical mechanics
2681,pm.stackexchange.com.txt,ProjectLibre: One person two tasks at the same time
2682,sharepoint.stackexchange.com.txt,How to extend a ListView WebPart (from code)
2683,retrocomputing.stackexchange.com.txt,Do any Atari 8-bit emulators produce the disk / tape I/O sound?
2684,opensource.stackexchange.com.txt,"What ""non-commercial"" license is that?"
2685,ethereum.stackexchange.com.txt,What is the Long-Range-Attack in Proof-of-Stake?
2686,spanish.stackexchange.com.txt,"What does the ending ""-ón"" signify?"
2687,german.stackexchange.com.txt,Warum heißt es »Folgende Dinge tun etw.« aber »Die folgenden Dinge tun etw.«?
2688,patents.stackexchange.com.txt,Facebook can create apps or features if you use their API to use their features
2689,sound.stackexchange.com.txt,Beautiful ambience. What does that mean to you?
2690,gaming.stackexchange.com.txt,How should I allot my attribute points as a Mage in Dragon Age: Origins?
2691,ethereum.stackexchange.com.txt,Why 'web3.eth.syncing' (Truffle console) returns 'false' when actually the testnet is running?
2692,linguistics.stackexchange.com.txt,Loss of final s in Italian
2693,mathematica.stackexchange.com.txt,The underlying process of Integrate[]
2694,parenting.stackexchange.com.txt,"What benefits does using ""baby talk"" provide, and how do you maximize those benefits?"
2695,ux.stackexchange.com.txt,How can I describe what checkboxes do in a long list of items?
2696,philosophy.stackexchange.com.txt,"Is This An Example of the Straw Man Fallacy or Something Else Entirely? If So, What Fallacy Is It?"
2697,philosophy.stackexchange.com.txt,What step in this argument is the least valid?
2698,movies.stackexchange.com.txt,Why do movies still have credits?
2699,pets.stackexchange.com.txt,Is it right to have puppies locked?
2700,stellar.stackexchange.com.txt,Stellar scalability to 4000 tx/s
2701,literature.stackexchange.com.txt,"Was the Marvel ""Punisher"" title a response to Frank Miller's ""The Dark Knight Returns""?"
2702,rus.stackexchange.com.txt,«На яхте будеЕТ три мачты» или «будУТ три мачты»?
2703,philosophy.stackexchange.com.txt,How to improve critical thinking?
2704,tor.stackexchange.com.txt,Create hidden service of remote virtual host
2705,ham.stackexchange.com.txt,Understanding of NFC Reader Antenna matching
2706,mythology.stackexchange.com.txt,What is the source of the fable of Thor’s attempt to drink up a small spring?
2707,poker.stackexchange.com.txt,How does an opponent's all-in range change after showing an all-in bluff in an online heads-up tournament?
2708,freelancing.stackexchange.com.txt,IP Contract clause help for Freelance project
2709,ukrainian.stackexchange.com.txt,"Використання скорочень ""стор."" ""с."" ""ст."" ""стр."" ""сс."" тощо для позначення сторінок у бібліографічному описі книги"
2710,judaism.stackexchange.com.txt,How we can we mutar shaving?
2711,latin.stackexchange.com.txt,Three (very similar) mottoes and a general grammar question
2712,tezos.stackexchange.com.txt,Issues resetting the ledger HWM
2713,ham.stackexchange.com.txt,Protect rig from static charge on antenna
2714,superuser.com.txt,How can i assign multiple IP addresses to an NIC (possibly software solution)?
2715,law.stackexchange.com.txt,Can an email to a 3rd party be admitted as an evidence in the court? (Family Law UK)
2716,gaming.stackexchange.com.txt,Can I secretly kill every guard in a town?
2717,politics.stackexchange.com.txt,What is the mechanism of legal action of the motion tomorrow on the Withdrawal Agreement?
2718,expressionengine.stackexchange.com.txt,Using Multi-config in a subdirectory?
2719,lifehacks.stackexchange.com.txt,Prevent cables of kitchen appliances from breaking when you coil them
2720,security.stackexchange.com.txt,Communicate between two sites both with SSL
2721,freelancing.stackexchange.com.txt,Writer/editor: Building presence and social media sites
2722,japanese.stackexchange.com.txt,"Using だということ to mean ""that"""
2723,or.stackexchange.com.txt,Bridge the gap between theory and practice in Integer Programming
2724,martialarts.stackexchange.com.txt,Dementia Pugilistica and Chronic Traumatic Encephalopathy: How to know when to call it quits?
2725,law.stackexchange.com.txt,Can a former employer (U.S.) use/withhold owed commissions as leverage?
2726,korean.stackexchange.com.txt,Why is 한국어 not spelled as 한구거?
2727,hinduism.stackexchange.com.txt,What scriptures mention correlation between Kailasa and Sahasrara?
2728,korean.stackexchange.com.txt,How to express a smoke interdiction in a classroom
2729,gardening.stackexchange.com.txt,Why does my tomato plant have tightly shrivelled green leaves?
2730,sqa.stackexchange.com.txt,Strategies for automating testing on features that are only on certain environments
2731,softwarerecs.stackexchange.com.txt,Web-based or hosted remote access software
2732,graphicdesign.stackexchange.com.txt,What were some the main trends/breakthroughs of web design?
2733,space.stackexchange.com.txt,Which high-resolution Earth-facing satellites transmit data to the public in realtime?
