,labels,sentences
7362,mythology.stackexchange.com.txt,How does one get purified of murder in Greek mythology?
7363,languagelearning.stackexchange.com.txt,Can practicing vocabulary from L2 to the same L2 instead of from L2 to L1 be more effective for learning the vocabulary?
7364,poker.stackexchange.com.txt,Best zoom poker bot strategy
7365,poker.stackexchange.com.txt,Two straights and a pair who wins?
7366,genealogy.stackexchange.com.txt,"Civil War Pension Cards - ""Date Of Filing"" explanation"
7367,softwareengineering.stackexchange.com.txt,"Interested in a million things, have a million goals: how to choose what to focus on"
7368,patents.stackexchange.com.txt,Is there a clear advantage of filing a Continuation application with new claims vs. heavy revisions of original claims?
7369,expatriates.stackexchange.com.txt,UK residency for Japanese wife of British citizen
7370,superuser.com.txt,"Terminal: On wake, mount external disk automatically"
7371,mechanics.stackexchange.com.txt,"How does a push-to-start system ""know"" when to disengage the starter motor?"
7372,retrocomputing.stackexchange.com.txt,When did schools stop caring about form factor?
7373,sustainability.stackexchange.com.txt,"How ""heavy duty"" does a compostable container need to be to hold hot food?"
7374,sitecore.stackexchange.com.txt,"What are the main improvements of Sitecore 8.2, compared to 8.1?"
7375,graphicdesign.stackexchange.com.txt,Do you know what font this is?
7376,martialarts.stackexchange.com.txt,Has anyone studied the demographics of martial arts?
7377,money.stackexchange.com.txt,EU deposit guarantee fund for failed state guarantee
7378,matheducators.stackexchange.com.txt,Assessing the level of students in a class
7379,russian.stackexchange.com.txt,Have your cake and eat it too - Equivalent Expression in Russian
7380,italian.stackexchange.com.txt,"Come posso dire a una persona ""take your time"" in italiano?"
7381,expatriates.stackexchange.com.txt,Adsense income (Online Blogging) issue for a F1 student
7382,stellar.stackexchange.com.txt,How can I find out the seed key for my genesis account on a local testnet?
7383,skeptics.stackexchange.com.txt,Was this image used in an anti-rape advertising campaign?
7384,eosio.stackexchange.com.txt,"getActions(accountName), possible names? | actions.action_trace.act.name"
7385,writers.stackexchange.com.txt,"Requesting A Writing Critique, Hopefully More Focused"
7386,softwareengineering.stackexchange.com.txt,What kind of metrics should I collect for a website/web app
7387,photo.stackexchange.com.txt,Equipment for shooting while on a bike?
7388,writers.stackexchange.com.txt,Inserting piece of writing into a character's dialogue
7389,scicomp.stackexchange.com.txt,Algorithm to find boundary faces of mesh
7390,esperanto.stackexchange.com.txt,"About the ""object"" of a sentence"
7391,retrocomputing.stackexchange.com.txt,Why is the RM Nimbus PC-186 not IBM PC compatible?
7392,japanese.stackexchange.com.txt,What does using という add to a sentence?
7393,gaming.stackexchange.com.txt,Torchlight - How do you feed fish to yourself?
7394,korean.stackexchange.com.txt,"When learning Korean, is it better to learn formal only?"
7395,physics.stackexchange.com.txt,Why is the angle of the wake of a duck constant?
7396,law.stackexchange.com.txt,Can I leave my girlfriend/wife to someone in my will?
7397,superuser.com.txt,"I swapped out the hard drive in my Western Digital Passport (2.5"") enclosure and now it isn't showing up in Windows 7"
7398,sitecore.stackexchange.com.txt,Sitecore 9 Federated Authentication mapping with existing users
7399,pets.stackexchange.com.txt,Is it possible to create an air pump from leaf blower?
7400,money.stackexchange.com.txt,"TurboTax is telling me to open an IRA now, and get a $5K deduction this year, is this a smart thing to do?"
7401,hsm.stackexchange.com.txt,Why is Maxwell and not Ampère credited for unifying electricity and magnetism?
7402,matheducators.stackexchange.com.txt,How much time to spend on a single question?
7403,health.stackexchange.com.txt,Red colors food and impact on stool colors
7404,opendata.stackexchange.com.txt,Historical data on buy-sell recommendations by stock market analysts
7405,skeptics.stackexchange.com.txt,"Do alcoholic ""digestives"" help digestion?"
7406,fitness.stackexchange.com.txt,Correct form and technique in single leg db deadlifts in detail
7407,literature.stackexchange.com.txt,Who does the cat represent in Animal Farm?
7408,interpersonal.stackexchange.com.txt,How can I tell someone to talk to a professional instead of me without seeming dismissive?
7409,french.stackexchange.com.txt,La phrase nominale « je ne sais quoi » et la phrase adjectif « je ne sais quel/quelle »
7410,rus.stackexchange.com.txt,"Нужно ли ставить запятую в конструкции ""<глагол> и поэтому <глагол>"""
7411,latin.stackexchange.com.txt,Does anyone learn Latin as a native language?
7412,writers.stackexchange.com.txt,Why shouldn't I use a pen name?
7413,health.stackexchange.com.txt,Is there any test to identify bacteria?
7414,mythology.stackexchange.com.txt,"The concept that scripture is made to adapt to changes of society, technology, and language"
7415,spanish.stackexchange.com.txt,How do the second person present forms of *ser* divert from Latin?
7416,ru.stackoverflow.com.txt,Какую библиотеку использовать при создании gui на win?
7417,mechanics.stackexchange.com.txt,Testing and diagnosis for hissing sound only in forward gears 2000 Toyota Camry-LE
7418,spanish.stackexchange.com.txt,¿Qué palabra podemos usar para indicar que nos quitamos una pieza de ropa?
7419,pt.stackoverflow.com.txt,Buscar os dados dos últimos 7 dias a partir da data actual
7420,hinduism.stackexchange.com.txt,What is the exact way of doing fast on Shivratri?
7421,hermeneutics.stackexchange.com.txt,"In Matthew 21:16, did Jesus misquote Psalms 8:2 by saying “praise” instead of “strength”?"
7422,retrocomputing.stackexchange.com.txt,How did debugging software run without memory protection?
7423,pm.stackexchange.com.txt,How to filter the tasks that have a non-estimated duration?
7424,ux.stackexchange.com.txt,Triple-State (or Multi-State) UI Object (Button)
7425,sports.stackexchange.com.txt,Is traveling/carrying no longer called for dribbling players?
7426,hsm.stackexchange.com.txt,Two questions about Gauss's contributions to capillarity and the calculus of variations
7427,softwareengineering.stackexchange.com.txt,Parent and child permission schemes
7428,stackapps.com.txt,"Why are Meta sites' ""site_state"" = ""linked_meta""?"
7429,softwarerecs.stackexchange.com.txt,phpMyAdmin or MySQL Workbrench simple alternative for learning
7430,ethereum.stackexchange.com.txt,Are gas limit in transaction and block gas limit different?
7431,hinduism.stackexchange.com.txt,Do Hindu scriptures talk about how to handle conflicts between prescriptions in scripture and the secular law of the land?
7432,ham.stackexchange.com.txt,What antenna on a BaoFeng UV-5R Pro will give me better reception?
7433,tor.stackexchange.com.txt,Vanity onion address not working properly
7434,mythology.stackexchange.com.txt,"Is Baba Yaga always the antagonist, or sometimes the protagonist?"
7435,eosio.stackexchange.com.txt,What's the relationship between eosio-abigen and eosiocpp?
7436,tezos.stackexchange.com.txt,Pruning empty accounts or inactive contracts?
7437,literature.stackexchange.com.txt,Which book is the maxim 大道無門 from?
7438,latin.stackexchange.com.txt,How can one predict the length of theme vowels in verbs?
7439,gaming.stackexchange.com.txt,Can I play the PAL version of Battlefield 3 on a NTSC xbox360?
7440,lifehacks.stackexchange.com.txt,How to reduce Dust in an appartment - use sticky tape?
7441,stackapps.com.txt,"Array of all Stack Exchange sites with Name, URL and Description"
7442,iot.stackexchange.com.txt,How does APN affect cellular connectivity?
7443,ukrainian.stackexchange.com.txt,Як правильно: людвісарня чи людвисарня?
7444,law.stackexchange.com.txt,Can we freely delete our questions and answers?
7445,languagelearning.stackexchange.com.txt,How to remember words and improve my vocabulary
7446,expressionengine.stackexchange.com.txt,Category group ordering within categories tab
7447,security.stackexchange.com.txt,What boxed solutions exist for taking care of Authentication? Mostly focused around websites
7448,pm.stackexchange.com.txt,Project 2010 schedule a task ALAP using a deadline
7449,sitecore.stackexchange.com.txt,"Setting up WFFM for ""Sitecore® Web Experience Manager 8.2"" on Azure"
7450,webmasters.stackexchange.com.txt,What do you look at when viewing competitors websites?
7451,iota.stackexchange.com.txt,Spam Attack on the tangle worst scenario
7452,fitness.stackexchange.com.txt,How to make a well balanced diet?
7453,german.stackexchange.com.txt,"How to say ""now a days..."" / ""nowadays"" in German?"
7454,graphicdesign.stackexchange.com.txt,Grid is not zeroed in Illustrator
7455,math.stackexchange.com.txt,Chromatic number and non-simple cycles
7456,quant.stackexchange.com.txt,Risk neutrality correction for Monte Carlo Bootstrapping according to PRIIP regulation for products of category III
7457,fitness.stackexchange.com.txt,Improving my Bench Press - what muscles are used during what phase?
7458,russian.stackexchange.com.txt,What is the difference between using который or какой?
7459,sports.stackexchange.com.txt,Football: final score when one team gets 5 players sent off?
7460,pets.stackexchange.com.txt,What makes a treat only suitable for a certain age range?
7461,joomla.stackexchange.com.txt,"How does the JSession works, and how to use it in different files?"
7462,mathematica.stackexchange.com.txt,CUDALink not working on Mac OS X
7463,english.stackexchange.com.txt,A saying for something that's good but also has a downside
7464,expatriates.stackexchange.com.txt,Can a K-1/Pending LPR receive discounted (copay) healthcare? (USA)
7465,esperanto.stackexchange.com.txt,"What is the difference between ""gambo"" and ""kruro""?"
7466,unix.stackexchange.com.txt,How to play RTSP stream under Linux for the BOSCH AutoDome Junior HD IVA camera?
7467,musicfans.stackexchange.com.txt,What genre is Zac Brown Band's Mango Tree
7468,sustainability.stackexchange.com.txt,"How is sustainability determined for a product or system, and by whom?"
7469,hermeneutics.stackexchange.com.txt,"What do the words ""fear and trembling"" in Philippians 2 refer to?"
7470,hermeneutics.stackexchange.com.txt,Why did NA27 include 2 Corinthians 13:14?
7471,softwarerecs.stackexchange.com.txt,Windows 8 Synchronize two external hard drives (for backup)
7472,travel.stackexchange.com.txt,Rule of length of stay in UK with visa?
7473,english.stackexchange.com.txt,"What is a single word describing a person who opposes another, yet is of equal status to them?"
7474,joomla.stackexchange.com.txt,Login Form Module redirects not working
7475,health.stackexchange.com.txt,Is Depo-Provera shot directly start working?
7476,movies.stackexchange.com.txt,Why did Verbal get legal immunity?
7477,opendata.stackexchange.com.txt,Should we open our data?
7478,ux.stackexchange.com.txt,Good solutions for boolean filter with sub conditions
7479,travel.stackexchange.com.txt,Do I need a transit visa with an Indian passport?
7480,eosio.stackexchange.com.txt,Best practice for storing private key in server
7481,hardwarerecs.stackexchange.com.txt,Choice of single-board computer for video output in embedded system
7482,windowsphone.stackexchange.com.txt,Whitelist email sender or mark email as not junk
7483,mechanics.stackexchange.com.txt,"Which types of air filters are best at filtering, without causing notable problems?"
7484,graphicdesign.stackexchange.com.txt,How to navigate to given coordinates in paint.net?
7485,fitness.stackexchange.com.txt,"Is it possible to ""tone"" up your muscles?"
7486,movies.stackexchange.com.txt,What is the computer that Benny Hill hacks in the Italian job? (1969)
7487,patents.stackexchange.com.txt,Keyword trends - Detecting trends in a stream of words using frequency analysis (Citizennet) - Patent Application - PRIOR ART REQUEST
7488,stackoverflow.com.txt,What is the Best Practice to Kick-off Maintenance Process on ASP.NET
7489,joomla.stackexchange.com.txt,Custom Joomla 3.4 Finder Plugin Not Displaying in Results
7490,travel.stackexchange.com.txt,Which countries allow tourists to get married without the long wait for the marriage licence?
7491,mechanics.stackexchange.com.txt,"Under what conditions ""BRAKE"" light in dashboard can be related to malfunctioning ABS?"
7492,stackoverflow.com.txt,How to find out which Service Pack is installed on SQL Server?
7493,raspberrypi.stackexchange.com.txt,Watch for GPIO button while running a timer
7494,tridion.stackexchange.com.txt,Success Notification XML in 2009 is not read by transport service in 2013
7495,pm.stackexchange.com.txt,When should the architecture of an enterprise level project be created in Scrum?
7496,networkengineering.stackexchange.com.txt,Extend MACSec encryption over provider bridge
7497,islam.stackexchange.com.txt,Stages at which haram things are allowed
7498,musicfans.stackexchange.com.txt,"Why does Pink Floyd's ""Wish You Were Here"" album cover show someone spontaneously combusting?"
7499,retrocomputing.stackexchange.com.txt,Which graphics adapters outputted S-Video over VGA?
7500,musicfans.stackexchange.com.txt,Mods vs Rockers - who won?
7501,travel.stackexchange.com.txt,Can I do volunteer work while visiting for 2 months in Amsterdam?
7502,stackapps.com.txt,Afterstack - Productivity tool for the Stack Exchange Network sites
7503,pm.stackexchange.com.txt,Setting default issue type in JIRA
7504,ux.stackexchange.com.txt,When is the right time to introduce discussion boards on a niche based social site?
7505,gamedev.stackexchange.com.txt,XNA button mouse click stop propagation
7506,italian.stackexchange.com.txt,"""Al riguardo di"" and ""a riguardo di"""
7507,sports.stackexchange.com.txt,NFL: Why do kick coverage teams always run all the way down the field
7508,spanish.stackexchange.com.txt,Backchannels (listener responses) in Spanish
7509,tezos.stackexchange.com.txt,How to receive payments with Velos?
7510,softwarerecs.stackexchange.com.txt,Google Chrome Extension that can bypass surveys?
7511,windowsphone.stackexchange.com.txt,Windows store app developers?? Is it so hard to develop applications for windows store?
7512,patents.stackexchange.com.txt,When will the patent office change for free the drawing published on an application?
7513,unix.stackexchange.com.txt,Why does '/' have an '..' entry?
7514,pt.stackoverflow.com.txt,Replace javascript não funciona de forma geral
7515,german.stackexchange.com.txt,"Wann benutzt man ""Für drei Tage"", ""von drei Tage"" und ""drei Tage""?"
7516,hinduism.stackexchange.com.txt,Who are the 11 rudras which are mentioned in Vedas?
7517,esperanto.stackexchange.com.txt,Why do so many prejudices and misinformation exist about Esperanto?
7518,gis.stackexchange.com.txt,Is it possible to run an R script on a layer in QGIS?
7519,tex.stackexchange.com.txt,What do \m@ne‎ and \@M do in the definition of \@makechapterhead?
7520,raspberrypi.stackexchange.com.txt,"Which raspberry pi model for playing with electronics, maybe more?"
7521,es.stackoverflow.com.txt,Pasar parametros al Constructor o a un metodo
7522,lifehacks.stackexchange.com.txt,Someone locked their bike to mine - now what?
7523,latin.stackexchange.com.txt,Help with paleography in a 16th century grant
7524,interpersonal.stackexchange.com.txt,How to rebuff probing questions when introducing my girlfriend to acquaintances as a friend?
7525,expressionengine.stackexchange.com.txt,Pre-sale Exp-resso question re: save for later and re-orders
7526,stellar.stackexchange.com.txt,Fill or Kill (FOK) offers on Stellar?
7527,quantumcomputing.stackexchange.com.txt,Do the probability amplitudes describe the probability of projective measurement?
7528,quantumcomputing.stackexchange.com.txt,How to reset classical register on QISKit
7529,musicfans.stackexchange.com.txt,"Who performs the vocals in Jedi Mind Tricks' ""Before The Great Collapse""?"
7530,ethereum.stackexchange.com.txt,"If I try to send to send ether to the standard token contract, the tx is rejected. Even if function() is modified as below. Why?"
7531,sqa.stackexchange.com.txt,procedure and prerequisites for installing selenium
7532,esperanto.stackexchange.com.txt,"What does ""vialangulo"" mean, in the song ""Societo de Vivantaj Poetoj""?"
7533,expressionengine.stackexchange.com.txt,Use onClick to update the status of an entry
7534,linguistics.stackexchange.com.txt,Why is it believed the West Germanic /i/ became /aɪ/ in some cases?
7535,sitecore.stackexchange.com.txt,Error while resolving field boosting on CD server
7536,worldbuilding.stackexchange.com.txt,How might microscopic humanoids contain electricity?
7537,french.stackexchange.com.txt,"Help with one definition of ""déterminer"" found in an old French dictionary"
7538,german.stackexchange.com.txt,"""In den Abend"" or ""im Abend"" - the case of Abend followed by ""in"""
7539,spanish.stackexchange.com.txt,Does pelón/pelona mean bald or hairy?
7540,worldbuilding.stackexchange.com.txt,Subtle harmless use of power to sense or manipulate someone's subconcious thoughts
7541,law.stackexchange.com.txt,Why couldn't potential grounds of justification be expanded within Art 36 TFEU?
7542,sports.stackexchange.com.txt,How exactly are two teams to be relegated from IIHF World Championships decided?
7543,law.stackexchange.com.txt,"What are legal requirements for privacy policy for a website hosted in the US, used in Europe and with technical cookies only?"
7544,pm.stackexchange.com.txt,Is the PM's required knowledge in agile environment changing nowadays?
7545,lifehacks.stackexchange.com.txt,How to fix a keyboard with a missing leg?
7546,math.stackexchange.com.txt,Is $0$ a natural number?
7547,history.stackexchange.com.txt,Are there any historical examples of (non government-approved) fake news having a strong effect?
7548,woodworking.stackexchange.com.txt,How do I fix chuck wobble in my drill press?
7549,scicomp.stackexchange.com.txt,Solving the convection-diffusion equation using finite differences at high Peclet numbers
7550,workplace.stackexchange.com.txt,How to handle time off for surgery?
7551,politics.stackexchange.com.txt,Why don't political parties support independent candidates to the extreme of their opponent to split the opposition vote?
7552,health.stackexchange.com.txt,How long does it take for the simple sugars in a drink to reach the bloodstream?
7553,iota.stackexchange.com.txt,What sensor could I use to contribute to the data marketplace when it goes live?
7554,esperanto.stackexchange.com.txt,"How to translate the expression ""ready, steady, go""?"
7555,opendata.stackexchange.com.txt,I need data set for climate changes in San Diego?
7556,superuser.com.txt,Using IF software in Ubuntu
7557,ux.stackexchange.com.txt,Why do ATMs need to take your card in?
7558,interpersonal.stackexchange.com.txt,"What is the best way to deal with ""reserved"" seats at place like a hotel pool?"
7559,spanish.stackexchange.com.txt,Conjugation of dar with the pronoun vos
7560,math.stackexchange.com.txt,5-vertex graphs with vertices of degree 2
7561,serverfault.com.txt,How does SharePoint licensing work?
7562,tridion.stackexchange.com.txt,Possible to get the Page URI from a URL in SDL Web 8?
7563,esperanto.stackexchange.com.txt,Which is the fastest that anyone documented on video has learnt conversational Esperanto?
7564,puzzling.stackexchange.com.txt,What is an Amplified Word™?
7565,security.stackexchange.com.txt,Explain SSL advantages for e-commerce to layperson?
7566,portuguese.stackexchange.com.txt,Nome de cidade e estado com hífen
7567,latin.stackexchange.com.txt,Mediterranean Sea name in Old Latin
7568,portuguese.stackexchange.com.txt,O português é considerado muito complexo por especialistas da língua?
7569,lifehacks.stackexchange.com.txt,Verify the accuracy of ph test strips
7570,french.stackexchange.com.txt,"Translation of ""to the best of the author's knowledge"""
7571,gis.stackexchange.com.txt,Splitting polygon with line using ArcPy?
7572,stellar.stackexchange.com.txt,How to cash out a currency?
7573,mythology.stackexchange.com.txt,In ancient Egypt what did the Ba and the Ka represent?
7574,mechanics.stackexchange.com.txt,Do products like Redex work?
7575,german.stackexchange.com.txt,Where to find samples of modern German handwritten text?
7576,opensource.stackexchange.com.txt,Can I create a GPL licensed server and use it in a commercial product?
7577,space.stackexchange.com.txt,Are there any techniques of heat shielding an irregularly shaped object?
7578,patents.stackexchange.com.txt,Are royalties due to a patent holder who's work has been cited by other inventors?
7579,eosio.stackexchange.com.txt,Is LevelDB used in EOS?
7580,eosio.stackexchange.com.txt,"EOS smart contract upgrading/recompiling, variables and symbol mappings"
7581,security.stackexchange.com.txt,Heartbleed: OpenSSL v 0.9.8o and OpenVPN v 2.1.3 Reporting Vulnerable
7582,german.stackexchange.com.txt,Translation of 'WHY' to german in this context
7583,eosio.stackexchange.com.txt,Missing config.ini after build EOS
7584,mechanics.stackexchange.com.txt,Is it difficult to retrofit Air Conditioning?
7585,pm.stackexchange.com.txt,The roles understanding in the agile development / Is the PO always right?
7586,sound.stackexchange.com.txt,What video editing software allows for easy alignment of visual transitions with the soundtrack?
7587,gamedev.stackexchange.com.txt,Accessing managers from game entities/components
7588,softwarerecs.stackexchange.com.txt,Fill every blank line with a difference from next line
7589,networkengineering.stackexchange.com.txt,Why doesnt Bluetooth Low Energy interfere with Wifi
7590,reverseengineering.stackexchange.com.txt,Which encryption/decryption algorithm is used in Synology Cloud Sync format 3.0 session key and data encryption?
7591,matheducators.stackexchange.com.txt,Exam Writing: Combining Topics on Exams in New Ways
7592,politics.stackexchange.com.txt,Taking over cellphone when texting while driving
7593,expatriates.stackexchange.com.txt,Single Status Letter for the Netherlands
7594,movies.stackexchange.com.txt,How did the Resistance know their planet was the next target?
7595,sustainability.stackexchange.com.txt,What can be used to power an incinerator that produces electricity?
7596,gaming.stackexchange.com.txt,Poe souls in Zelda: Twilight Princess
7597,opensource.stackexchange.com.txt,Is it possible to stop the removal/modification of my project's logo?
7598,eosio.stackexchange.com.txt,Blacklisting specific addresses on token::transfer
7599,writers.stackexchange.com.txt,"What is the key to creating a independent character, female and male?"
7600,patents.stackexchange.com.txt,What if the inventor of the idea is dead?
7601,softwarerecs.stackexchange.com.txt,Tool for deploying web-project to the server
7602,japanese.stackexchange.com.txt,Is it true that only girls use うち to refer to themselves?
7603,ux.stackexchange.com.txt,Should I offer a button to start animations on comment sections or autoplay them?
7604,hinduism.stackexchange.com.txt,What is Sapta Vidha Anupapatti? who has written that work?
7605,homebrew.stackexchange.com.txt,"How much ""speise"" in a Hefeweizen?"
7606,iot.stackexchange.com.txt,How can I securely support unlocking my door through Google Home?
7607,sustainability.stackexchange.com.txt,Is the cardboard from a firework box recyclable?
7608,magento.stackexchange.com.txt,Magento system log filling up with CSS and JS debug messages
7609,latin.stackexchange.com.txt,A plausible technical term for 'boiler'
7610,webapps.stackexchange.com.txt,Adding users to my Cognito Forms account
7611,physics.stackexchange.com.txt,Number of Components of a Spinor
7612,ux.stackexchange.com.txt,iOS iAd and Freemium inside the same app
7613,eosio.stackexchange.com.txt,latest EOSJS (20.0.0-beta2): missing node_modules/eosjs/lib/index.js?
7614,stackapps.com.txt,Tag Nukificator: Review and remove tags
7615,pets.stackexchange.com.txt,Should my cat love having his fur pulled out?
7616,parenting.stackexchange.com.txt,Can I insist my daughter to be non beliver in religions?
7617,sqa.stackexchange.com.txt,Suggest some Android and iPhone mobile app automation tools
7618,mechanics.stackexchange.com.txt,Is it legal to put a Ferrari engine in another car if you are not certified by Ferrari?
7619,ux.stackexchange.com.txt,How Many Screenshots Are Too Many
7620,pm.stackexchange.com.txt,Documenting requirements on an Agile project
7621,outdoors.stackexchange.com.txt,How do hikers cross fast-flowing rivers without wading staffs?
7622,genealogy.stackexchange.com.txt,"Looking for marriage of Annie Elizabeth to James Spencer Ward, ca 1900 in Cheshire?"
7623,japanese.stackexchange.com.txt,Usage of 立ち話もなんです in this sentence
7624,hermeneutics.stackexchange.com.txt,"How is the New World Translation's usage of ""Jehovah"" controversial?"
7625,law.stackexchange.com.txt,"Example of ""fraus omnia corrumpit"" in which a person loses rights they had before a fraudulent act?"
7626,stackoverflow.com.txt,How to set an HTTP header while using a Flex RemoteObject method?
7627,softwarerecs.stackexchange.com.txt,Software for scanning/printing documents in a large size for visually impared student
7628,russian.stackexchange.com.txt,Where to find parallel English-Russian novels to learn Russian?
7629,patents.stackexchange.com.txt,Checking patent application's status before it is published
7630,opensource.stackexchange.com.txt,Choosing a license based on conditions or an extensible license
7631,webmasters.stackexchange.com.txt,no-www redirect not working / DNS A record
