,labels,sentences
0,health.stackexchange.com.txt,Are there health issues with gaining 24 pounds in one year if otherwise healthy?
1,stats.stackexchange.com.txt,Why are random effects shrunk towards 0?
2,eosio.stackexchange.com.txt,"In dfuse, how do I use `get_action_traces` to get notifications when certain transaction is created and when it's irreversible?"
3,webmasters.stackexchange.com.txt,Script to determine the SSL certificate assigned to each site
4,lifehacks.stackexchange.com.txt,How do I securely tie my shoes?
5,softwareengineering.stackexchange.com.txt,Does the programming language or database you use have any effect on the selling of your site?
6,robotics.stackexchange.com.txt,Build a drone with a raspberry pi 2 as receiver for the CC3D-LibrePilot
7,parenting.stackexchange.com.txt,Why are parents so concerned about not letting the babies sleep with them?
8,pt.stackoverflow.com.txt,$zero - O que faz e como funciona?
9,eosio.stackexchange.com.txt,"How cpu, ram works for eos and are transactions free?"
10,hsm.stackexchange.com.txt,Which book covers topology historically?
11,stats.stackexchange.com.txt,Statistical test for trend (continuous variable) in Stata or R
12,es.stackoverflow.com.txt,¿Cuál es la diferencia entre String y string?
13,sharepoint.stackexchange.com.txt,Merge SP list data into a word document
14,sitecore.stackexchange.com.txt,Recursive upgradeable lock acquisitions not allowed in this mode exception while accessing Sitecore configuration while initiating the IoC container
15,martialarts.stackexchange.com.txt,What is the best way to avoid armlocks?
16,martialarts.stackexchange.com.txt,How helpful is it to film yourself during training and analyze videos after training?
17,pt.stackoverflow.com.txt,"Como remover do título <title> do painel a palavra ""WordPress""?"
18,japanese.stackexchange.com.txt,"What does ""夢を売る"" mean? sell a dream?"
19,iota.stackexchange.com.txt,How do I generate a wallet from a seed?
20,iot.stackexchange.com.txt,Selecting a microcontroller for a battery operated data collection project
21,iota.stackexchange.com.txt,How can you have side chains and still protect against double spending?
22,tezos.stackexchange.com.txt,"""Missing protocol 'ProtoGenesis' for the current block"" when I lanch a node"
23,mythology.stackexchange.com.txt,Narratives in Haitian (or other) Vodou?
24,philosophy.stackexchange.com.txt,A Marxist Theory of Justice?
25,reverseengineering.stackexchange.com.txt,What's the meaning of dword_XXXX and offset dword_XXXX in IDA?
26,lifehacks.stackexchange.com.txt,How to keep your hands warm in winter while working on a laptop?
27,iot.stackexchange.com.txt,How does URL Remote Access method work?
28,serverfault.com.txt,"SQL Server 2008 Express - ""Best"" backup solution?"
29,korean.stackexchange.com.txt,Difference between 보고싶어 and 보고싶다
30,worldbuilding.stackexchange.com.txt,Stopping a cavalry charge by destroying the ground in front of it?
31,homebrew.stackexchange.com.txt,What can I use for a small-batch fermentation vessel?
32,pm.stackexchange.com.txt,How can a team member moderate a retrospective?
33,tezos.stackexchange.com.txt,How many full nodes on the tezos network?
34,philosophy.stackexchange.com.txt,"Quine's ""to be is to be the value of a bound variable"""
35,stellar.stackexchange.com.txt,Asset type is always credit_alphanum12?
36,or.stackexchange.com.txt,Model or State Uncertainty in Queueing Model due to uncertain arrival rate
37,patents.stackexchange.com.txt,Does this patent apply to the USA
38,rpg.stackexchange.com.txt,Does the paladin's Divine Health feature protect against both common and magical diseases?
39,mechanics.stackexchange.com.txt,Low beam not working in headlight
40,languagelearning.stackexchange.com.txt,Identifying cases by rephrasing to a question – is this any useful for language learners?
41,german.stackexchange.com.txt,"Purpose of ""mich"" in the following translation"
42,russian.stackexchange.com.txt,Why are there verbs derived from ехать but not ездить?
43,puzzling.stackexchange.com.txt,Clueslessly searching for words III
44,lifehacks.stackexchange.com.txt,How can I stop a comb from falling out of clothing pockets?
45,mythology.stackexchange.com.txt,Is there a kami of Aokigahara?
46,webapps.stackexchange.com.txt,Counting unique values based on multiple columns
47,puzzling.stackexchange.com.txt,What is a Nonvocal Word™?
48,or.stackexchange.com.txt,Alternative definition for the value of stochastic solution
49,tezos.stackexchange.com.txt,How long does it take to sync the entire chain?
50,unix.stackexchange.com.txt,Solaris 10 : Remove trailing blank lines from multiple files
51,softwarerecs.stackexchange.com.txt,"Convert an enigmatic string using many common decoding algorithms, to check which one works"
52,sharepoint.stackexchange.com.txt,How to use non-browser forms created by Infopath Filler (published to a Sharepoint Form Library)?
53,mythology.stackexchange.com.txt,Iterative Creation Myths: Rare or Just Obscure?
54,languagelearning.stackexchange.com.txt,What resources do we have to learn German using our phone?
55,esperanto.stackexchange.com.txt,How does one build correlatives
56,movies.stackexchange.com.txt,How did Fawkes find the Chamber of Secrets?
57,italian.stackexchange.com.txt,"Qual è il significato di ""stigmate antonomastiche"" in questo brano?"
58,mechanics.stackexchange.com.txt,How to replace the fuse for both indicators on a Nissan Wingroad 2004?
59,homebrew.stackexchange.com.txt,Is a donation jar (for homebrew supplies) legal in the United States?
60,serverfault.com.txt,Virtual PC Performance Issue on 64-bit Vista
61,mythology.stackexchange.com.txt,How did Poseidon became lord of Helicon?
62,politics.stackexchange.com.txt,"Did Angela Merkel break ""the"" law by opening the borders to refugees?"
63,gamedev.stackexchange.com.txt,The recommended road map to be a good graphics/game engine programmer
64,writers.stackexchange.com.txt,How do you know when to give up on a writing project?
65,pm.stackexchange.com.txt,What are the required documents should I prepare In order to start my Project
66,tex.stackexchange.com.txt,paragraph design and single lines
67,opendata.stackexchange.com.txt,How do we query the college score card and just get all data but only for a given year?
68,sqa.stackexchange.com.txt,How to get coordinates of element inside iframe?
69,photo.stackexchange.com.txt,"What does ""maximum aperture"" mean in a camera spec? Where can I get the full aperture range?"
70,history.stackexchange.com.txt,Were there ever any libraries in medieval villages?
71,sharepoint.stackexchange.com.txt,Success Audit spamming event log
72,languagelearning.stackexchange.com.txt,Learning Indonesian (bahasa Indonesia) on my own
73,english.stackexchange.com.txt,How do I make correct referencing?
74,islam.stackexchange.com.txt,Drew animate things before knowing it is sin
75,graphicdesign.stackexchange.com.txt,Best file type of picture for print
76,lifehacks.stackexchange.com.txt,Diesel fuel smell out of clothing?
77,health.stackexchange.com.txt,What is the physiological process that would cause one to void more than once in the morning?
78,german.stackexchange.com.txt,"What's the difference between ""voll"" and ""völligen""?"
79,graphicdesign.stackexchange.com.txt,Can anyone identify this slab serif font that's perfect for branding some blue-collar organisations?
80,gardening.stackexchange.com.txt,What are the solid chunks in the top my carrots?
81,gamedev.stackexchange.com.txt,Why texture coordinate of flat surface reflection is calculated like this in fragment shader?
82,hardwarerecs.stackexchange.com.txt,External fan for over-heating laptop
83,vegetarianism.stackexchange.com.txt,Do some varieties of rice contain less arsenic?
84,genealogy.stackexchange.com.txt,Losing FamilySearch.org functionality from links to digital images. What am I doing wrong?
85,ux.stackexchange.com.txt,"Just made a web template, what changes should I make?"
86,history.stackexchange.com.txt,Did Japan perceive their hypergrowth as stable and unstoppable as the United States did?
87,languagelearning.stackexchange.com.txt,Identifying cases by rephrasing to a question – is this any useful for language learners?
88,freelancing.stackexchange.com.txt,How to control the clients sales funnel?
89,esperanto.stackexchange.com.txt,"What is the correct way to say ""to ask a question""?"
90,sports.stackexchange.com.txt,What kind of ball is used in the FIFA World Cup?
91,physics.stackexchange.com.txt,What are the best astronomy blogs and podcasts?
92,superuser.com.txt,trying to get antivirus policy changed
93,ja.stackoverflow.com.txt,Scala: クラス定義を追加すると、scala コマンドで main メソッドが実行されなくなる
94,magento.stackexchange.com.txt,How can I display all anchor categories even with no result (empty category)?
95,politics.stackexchange.com.txt,Does international law allow for recognising a different government than the one having operational control?
96,stellar.stackexchange.com.txt,How do I verify an asset that I've created on the Stellar Transaction builder?
97,quant.stackexchange.com.txt,economic facts that causes the financial time series to be heavy tailed
98,monero.stackexchange.com.txt,Why does the stealth address involve a hash function?
99,gaming.stackexchange.com.txt,Do I need to ascend the perk trees in order?
100,esperanto.stackexchange.com.txt,"Did the writer George Orwell hate Esperanto, and why if it is the case?"
101,ham.stackexchange.com.txt,Simulating two antennas (transmitter and receiver) using 4nec2 tool
102,pets.stackexchange.com.txt,How do I keep my neighbor's cat from defecating in my yard?
103,french.stackexchange.com.txt,Correct use of indefinite articles with plural objects and singular subjects
104,matheducators.stackexchange.com.txt,How to improve atmosphere in male-dominated courses
105,judaism.stackexchange.com.txt,What influences and books do modern Jews read today is it as it is said in the encylopedias? please help
106,sqa.stackexchange.com.txt,How to improve the code quality mindset?
107,ux.stackexchange.com.txt,Sorting alphabetically - best intuitive way to signify alphabetical ordering
108,expatriates.stackexchange.com.txt,Can my german employer rollback my promotion?
109,parenting.stackexchange.com.txt,How to improve my 5 year old son's behavior in pre-kindergarden?
110,writers.stackexchange.com.txt,how to elaborate a crime case
111,hermeneutics.stackexchange.com.txt,"What does Jesus mean by ""generation"" when talking about the destruction of the temple and the end of the age?"
112,german.stackexchange.com.txt,"Translations for ""Site"" in the context of a location?"
113,magento.stackexchange.com.txt,Initiate paypal refund online in magento
114,hinduism.stackexchange.com.txt,What is Ramanujacharya's argument that the Upanishads must be true if they grant Moksha?
115,stats.stackexchange.com.txt,How to apply an AR(MA) model to a prewhitened signal?
116,interpersonal.stackexchange.com.txt,My dog and I offended a new neighbor. How do we make it right?
117,spanish.stackexchange.com.txt,"¿Existe algún adjetivo en español para describir a alguien ""condenado al ostracismo""?"
118,softwarerecs.stackexchange.com.txt,Suitable engine for game with no movement
119,ethereum.stackexchange.com.txt,Why does a mining reward exist?
120,iot.stackexchange.com.txt,mosquitto - bridging options for remote client identifier
121,ethereum.stackexchange.com.txt,"Access multiple return values (a, b, c) from solidity function in web3js"
122,expatriates.stackexchange.com.txt,How do I import a vehicle from outside the EU to the UK?
123,expressionengine.stackexchange.com.txt,https and Control Panel mixed content error
124,pets.stackexchange.com.txt,What are the health risks if my pet has fleas?
125,quantumcomputing.stackexchange.com.txt,Can the SWAP test only compare registers with the same number of qubits?
126,softwareengineering.stackexchange.com.txt,Moving from TFS to Distributed SCM
127,photo.stackexchange.com.txt,Why are tripods forbidden in some public spaces and how to deal with it?
128,graphicdesign.stackexchange.com.txt,"Connector lines with knee (angle, multiple nodes) in Inkscape?"
129,english.stackexchange.com.txt,How do I refer to a number in an image in a scientific paper?
130,fitness.stackexchange.com.txt,What muscles are responsible for the flight phase of running?
131,japanese.stackexchange.com.txt,use of だって in this sentence
132,stats.stackexchange.com.txt,MATLAB quantiz - mean square distortion
133,literature.stackexchange.com.txt,"What can we learn from this character's death in ""Mockingjay"", out of universe?"
134,quant.stackexchange.com.txt,How to deal with negative ARCH terms?
135,engineering.stackexchange.com.txt,Generating a plasma via induction coil
136,graphicdesign.stackexchange.com.txt,How to stop snapping of slices when re-sizing?
137,monero.stackexchange.com.txt,Can view keys differentiate between payments and change?
138,tor.stackexchange.com.txt,consequences after having logged into a non-tor account
139,joomla.stackexchange.com.txt,Single Article menu item - inconsistent weirdness in paging through articles list
140,judaism.stackexchange.com.txt,Plants before the Sun in the Order of Creation
141,quantumcomputing.stackexchange.com.txt,In error correction code why don't we imitate the Hamming code instead of the complicated Steane code?
142,stellar.stackexchange.com.txt,Using IPFS hashes in stellar transaction / MEMO
143,reverseengineering.stackexchange.com.txt,"IDA - large jump table, missing cases in analysis"
144,mechanics.stackexchange.com.txt,How to use BG Fuel Injection System Cleaner?
145,writers.stackexchange.com.txt,"How should I set the inside margin for my 5x8"" book with Createspace?"
146,musicfans.stackexchange.com.txt,Techno-House theme where interpreter naming Roman Emperors in the lyrics
147,retrocomputing.stackexchange.com.txt,Was Family BASIC for the NES/Famicom powerful enough to create full games and applications?
148,monero.stackexchange.com.txt,Is automated churning of XMR bad for privacy?
149,patents.stackexchange.com.txt,Can a protocol for detection of acupuncture meridian blockage be patented?
150,webmasters.stackexchange.com.txt,"If your site has been flagged, ""this site may harm your computer"" how long before Google takes action"
151,stackapps.com.txt,I don't want to be a mod
152,serverfault.com.txt,What are reasonable values for --throttle on xtrabackup?
153,sitecore.stackexchange.com.txt,How to add custom lang-region in sitecore system language
154,french.stackexchange.com.txt,Se mettre sur son 31
155,gardening.stackexchange.com.txt,Why have my tomato leaves started yellowing at the base?
156,french.stackexchange.com.txt,Comment traduire « (the) vulnerable world hypothesis » ?
157,unix.stackexchange.com.txt,Solaris service status and dependencies
158,esperanto.stackexchange.com.txt,How do you say 'tamale' in Esperanto?
159,sitecore.stackexchange.com.txt,Experience Editor overwriting items edited elsewhere
160,worldbuilding.stackexchange.com.txt,What sort of problems might occur if every human gained extra muscle mass?
161,german.stackexchange.com.txt,"Should there be a hyphen in the construction ""IT affin""?"
162,hinduism.stackexchange.com.txt,What facts can be derived from the MahaSankalpam sloka?
163,gaming.stackexchange.com.txt,How Do I Change Unit Names?
164,sound.stackexchange.com.txt,What audio usb interface do I need to play guitar pro with guitar rig?
165,german.stackexchange.com.txt,"Ja klar, kann man machen"
166,softwarerecs.stackexchange.com.txt,Library or tool to point out floating point arithmetic issues on a code snippet
167,networkengineering.stackexchange.com.txt,GRE tunnel(or even any tunnelling technique) between Alcatel 7750 and a Cisco Router
168,parenting.stackexchange.com.txt,My toddler has a kind of facial spasm/seizure - how to find out more about it?
169,sound.stackexchange.com.txt,Is Apple Compressor Reliable for MP4 Conversion
170,mythology.stackexchange.com.txt,Is there a connection between Odin or Zeus and the Christian God?
171,webmasters.stackexchange.com.txt,MX changes for domain alias not propogating
172,es.stackoverflow.com.txt,como guardar una accion de jquery en el localstorage?
173,korean.stackexchange.com.txt,"what's the old korean saying, ""Nuh jukgo, nah jukja""?"
174,matheducators.stackexchange.com.txt,Should college mathematics always be taught in such a way that real world applications are always included?
175,french.stackexchange.com.txt,Films : Version doublée vs originale sous-titrée
176,worldbuilding.stackexchange.com.txt,Taking all the blood of a dozen humans and putting it into acid – could I create a wolf?
177,poker.stackexchange.com.txt,What are practical differences between 8-max and 9-max tournaments?
178,patents.stackexchange.com.txt,What is the invention in the application?
179,interpersonal.stackexchange.com.txt,"How can I politely tell someone who is ineffectively holding a door open for me, “Thanks, but no thanks.”"
180,tor.stackexchange.com.txt,How can Wget be configured to work with Torify securely?
181,iot.stackexchange.com.txt,What is the working voltage range of a Sonoff Touch?
182,expatriates.stackexchange.com.txt,Where to find non-anecdotal and up-to-date information regarding the cost of living in other countries?
183,gis.stackexchange.com.txt,Merge Error 000594 in ArcMap - falls outside of output geometry domains
184,security.stackexchange.com.txt,Error 150 (net::ERR_SSL_PINNED_KEY_NOT_IN_CERT_CHAIN): The server's certificate appears to be a forgery
185,rpg.stackexchange.com.txt,Where do Avandra and Melora reside?
186,pm.stackexchange.com.txt,How can I track time spent by assignees on each ticket in JIRA?
187,robotics.stackexchange.com.txt,Can ESC be programmed to run full throttle only on one side of a quadcopter?
188,ru.stackoverflow.com.txt,Нужны ли индексы на поля участвующие в join
189,ux.stackexchange.com.txt,Are editable grids and split pages with tabs bad web UX?
190,sharepoint.stackexchange.com.txt,Search terms incorrectly highlighted in results
191,quant.stackexchange.com.txt,Why do simulation schemes have difficulty in pricing options with low spots?
192,stats.stackexchange.com.txt,Probability Curve from logit model
193,graphicdesign.stackexchange.com.txt,Indesign cs5.5 export as Epub interactive
194,islam.stackexchange.com.txt,Can we license translation software for the Quran and Hadits?
195,softwareengineering.stackexchange.com.txt,Should a function use premature returns or wrap everything in if clauses?
196,money.stackexchange.com.txt,Overseas Foreign Earned Income; Can I take the Home Office Deduction for a home office based outside the United States?
197,tezos.stackexchange.com.txt,How to become a baker - what are all the technical/financial requirements?
198,tridion.stackexchange.com.txt,Core Service Client lack of robustness in Workflow
199,poker.stackexchange.com.txt,Variance - or rigged game
200,gis.stackexchange.com.txt,QGIS WMS ver 1.3.0 Exception with GeoServer
201,ethereum.stackexchange.com.txt,Need recovery of original JASON file for 3000 ether
202,opendata.stackexchange.com.txt,Is it the right query on what I am looking for in openFDA?
203,fitness.stackexchange.com.txt,How can I correctly log the calorie burn of circuit routines?
204,graphicdesign.stackexchange.com.txt,Load animated GIF in Photoshop CS4
205,ru.stackoverflow.com.txt,Открытие и навигация по сайту через C#
206,german.stackexchange.com.txt,Use of personal pronouns (including the polite forms)
207,graphicdesign.stackexchange.com.txt,How to resize canvas interactively in Photoshop CS6?
208,esperanto.stackexchange.com.txt,"How does one say ""suit yourself"" in Esperanto?"
209,spanish.stackexchange.com.txt,"¿Se usa ""halar"" en vez de ""jalar"" en algún lugar?"
210,sports.stackexchange.com.txt,Why did Game 1 of the 2015 ALDS have a start time that depended on another game?
211,gardening.stackexchange.com.txt,What's wrong with my gardenia?
212,security.stackexchange.com.txt,Is it safe to install metasploit in my daily-used computer?
213,space.stackexchange.com.txt,Where would one deploy deep space atomic clocks?
214,worldbuilding.stackexchange.com.txt,How Could A Time Traveller Communicate With Neanderthals?
215,stackoverflow.com.txt,Can't get my event to fire
216,matheducators.stackexchange.com.txt,Is simplifying a rational function considered as a continuous extension?
217,english.stackexchange.com.txt,Should I say a date differently from the way it is written?
218,scicomp.stackexchange.com.txt,Generate high n quantum harmonic oscillator states numerically
219,windowsphone.stackexchange.com.txt,apps on SD card when switching phones
220,hsm.stackexchange.com.txt,When was the modern field theory approach to Galois theory developed?
221,softwarerecs.stackexchange.com.txt,Mobile security and vulnerability analysis tool
222,law.stackexchange.com.txt,Am I allowed to sell photos online at 15?
223,linguistics.stackexchange.com.txt,Is the adverbial phrase and adverb phrase identical?
224,matheducators.stackexchange.com.txt,Is there an advantage to teaching solution of simultaneous equations by setting equations equal to each other?
225,islam.stackexchange.com.txt,Is it permissible to have a picture without the eye visible?
226,islam.stackexchange.com.txt,wife clothing in islam infront of her husband
227,law.stackexchange.com.txt,Can HIPPA be waived by contract with doctor and what constitutes one's 'medical status'?
228,wordpress.stackexchange.com.txt,How do I set up a custom URL shortener for my posts?
229,rus.stackexchange.com.txt,Необходима ли запятая перед вопросом
230,gis.stackexchange.com.txt,Clipping soil survey map service to feature class?
231,engineering.stackexchange.com.txt,How to predict shadows of a house (3D modeling + sunlight)?
232,tridion.stackexchange.com.txt,How to get INDEXER_REPLICATION_PORT that the syncserver is currently listening to?
233,esperanto.stackexchange.com.txt,"How can I say ""I wonder""?"
234,ukrainian.stackexchange.com.txt,"Простакувата назва ""Learn you %topic% for great good"" українською"
235,hsm.stackexchange.com.txt,"Why is harmonic oscillator creation operator called ""a-dagger"", $a^\dagger$?"
236,scicomp.stackexchange.com.txt,How can one produce a proper streamline plot?
237,health.stackexchange.com.txt,Is it possible to get a secondary infection following a flu shot
238,space.stackexchange.com.txt,Are crewed capsules equiped to land pretty much anywhere in the world?
239,tor.stackexchange.com.txt,List hidden service managed by an HSDIR
240,pm.stackexchange.com.txt,Where is the value in walking the board with a detailed task board?
241,engineering.stackexchange.com.txt,Is there an inward (radial) force acting on a magnet inside a magnet?
242,french.stackexchange.com.txt,Que veut dire « avait pu avoir » ?
243,italian.stackexchange.com.txt,"Posizione di ""sempre"" quando è accompagnato da un verbo"
244,russian.stackexchange.com.txt,Mainland Russia as seen from Kamchatka circa 1800
245,gaming.stackexchange.com.txt,How can I complete Bwemba's Spirit?
246,sports.stackexchange.com.txt,What are the powers of referee in a football match?
247,lifehacks.stackexchange.com.txt,How can I warm my feet in winter without shoes and socks?
248,engineering.stackexchange.com.txt,How is the relation between turbulence intensity and turbulent kinetic energy derived?
249,magento.stackexchange.com.txt,Sending the same item to multiple recipients
250,portuguese.stackexchange.com.txt,"What is the difference between ""embrulhar"", ""empacotar"", and ""agasalhar""?"
251,softwarerecs.stackexchange.com.txt,Is there any Tensorflow or common ANN guide for choosing right solution?
252,latin.stackexchange.com.txt,"Translation of ‘I am, therefore I thank’"
253,scicomp.stackexchange.com.txt,Newton method for a nonlinear system of time-independent PDEs
254,expressionengine.stackexchange.com.txt,low events conditional to show event date that lasts for more than one day
255,es.stackoverflow.com.txt,Consulta MySQL con REGEXP para agregar un ID si no está en el valor de un campo
256,retrocomputing.stackexchange.com.txt,Can I run Windows 98 and games from the same era on an AMD Duron CPU?
257,windowsphone.stackexchange.com.txt,Which Windows Phone restrictions makes benchmarking a challenge?
258,sharepoint.stackexchange.com.txt,Add description to the fields in newform.aspx and editform.aspx?
259,iota.stackexchange.com.txt,Iota White paper section 4.4. Random walkers
260,stellar.stackexchange.com.txt,Is it possible to have multiple issuer?
261,tor.stackexchange.com.txt,How to measure Page Load Time?
262,ux.stackexchange.com.txt,Combining Settings and About screens in a mobile web app
263,quant.stackexchange.com.txt,portfolio returns when portfolio value is negative
264,ru.stackoverflow.com.txt,Динамическое подставление полей в представлениях
265,pm.stackexchange.com.txt,Best measurable units for non cross-functional team estimation
266,ru.stackoverflow.com.txt,Как заменить ряды в таблице >3
267,genealogy.stackexchange.com.txt,Right to title being descended from Earl of Crewe?
268,space.stackexchange.com.txt,Is there a better way for astronauts to bathe?
269,iot.stackexchange.com.txt,Sending load information from devices to the coordinator
270,parenting.stackexchange.com.txt,What's a good home-based learning curriculum for a 2-year-old?
271,parenting.stackexchange.com.txt,How to remain unaffected by my 10-year-old son's angry outbursts?
272,networkengineering.stackexchange.com.txt,DHCP Layer 2 and Layer 3
273,opendata.stackexchange.com.txt,New delimited shapefile for Delhi
